,canal_ID,video_ID,video_Title
703,UC4oQAvXFuNlKivYjUynQKTA,r-ZQ7knkKa0,Cartilla educativa en España enseña a menores de 3 años a masturbarse. Hay polémica | Videos Semana
704,UCpuFGhof2PvGeWnI_b6mT-A,0y32d7EGdGo,NOTICIAS: Hamas al borde de romper la Tregua en ISRAEL | Mujer de 70 Años da luz a Gemelos
705,UCZH7n_Jk5DiLM47FTsG9ccg,tSi2kFSCPAU,experiencias emprendedoras en Latinoamérica
706,UCSqD_yLM6bUbQ0dsn0b75vw,KDGSHe55hxk,🥂 &quot;Yo te invito&quot; en ESPAÑOL 🇪🇸
707,UC0tKgp160gEYiofmhcZUrOQ,jkz6sPbaf-M,Psicología del Desarrollo I: &quot;Yo también puedo jugar&quot;
708,UCBIHROdJKBsvi-EVVoy_lkA,wFhpaKwyt2U,¡Norma Piña está furiosa! AMLO la dejó fuera ¡Sheinbaum barrió con Xóchitl en Michoacán!
709,UCf4xmNZdFGyawmIORQM6aBg,DR0b_RJna28,Claves para practicar sexo anal
710,UCrcYWzHrg55foUj7nVB6b2w,p-JAgXLWkhY,CULO
711,UC-iZcSmvVFSRER9y1UzTBLw,2tvaHaQv4rI,Caporales
712,UCEw4oyJKvmYPoIpSa8cfr7A,jv_VZkqE-cg,BAJO LA RED 1 - Película completa en español | Playz
713,UCxFFRhFEHlbBQqIf6cP3qQA,6WoJAQX5k6c,"ESCOLA INCLUSIVA JA! Dia internacional de les persones amb discapacitat, 3 de desembre de 2023."
714,UCn168kUcD_1ePJxJC8MpqHQ,pK09zywAyF8,Enfoque Educativo en el Uso de Tiktok y Linkedin
715,UCMxYReNebajb-xnmwD-3gIw,3KtBPiL5zgU,Crítica Deportiva (proyecto escolar)
716,UCQhzxUBuNIBXFxjoMVEgIhw,N64t6EN9bVM,🔴LOCURA en los HOSPITALES de WASHINGTON DC🔥CELEBRAN CUMBRE SECRETA | JILL BIDEN SORPRENDE A TODOS🚨
