,canal_ID,video_ID,video_Title
232,UCBLCvUUCiSqBCEc-TqZ9rGw,PLc_xQjQlCk,Diálogo sobre la capacidad de recuperación de la economía española
233,UC2Xq2PK-got3Rtz9ZJ32hLQ,0k-qGbhoUAI,Economía colombiana: ¿qué esperan los expertos para 2023?
234,UCQoBpL4bPR5louMlM2M2gog,aAKUdPid8FQ,JHON JAIRO CUELLAR: 5. ¿Porqué es importante la intervención del Estado en la economía?
235,UCPH3Oz99Y_jrVBCQMjQZNSg,d_vrcyqBslc,La REVOLUCIÓN CUBANA en 10 minutos | Breve historia de CUBA
236,UCT4Jg8h03dD0iN3Pb5L0PMA,SN9FSPbsToM,Principales noticias económicas de la semana
237,UC-yJ1V3fN75A4dlR6dgRgEg,br8_9Hy4dzg,💥 Bill Gates PREDICE la PEOR CRISIS económica |👉CÓMO puedes PROTEGERTE? |👉 Qué Planea?
238,UC9qwzTKXgfHvJuo87f9npKg,dRjzjihvTpw,"🌎 ¿Qué son las Actividades Económicas? 💰 Sector primario, secundario y terciario. 🌎 [Fácil y Rápido]"
239,UCsT0YIqwnpJCM-mx7-gSA4Q,1TQxM3lpCf4,Sobrevivir el aula | Hernán Aldana | TEDxPuraVidaED
240,UCfPrh2GfUkRFawG9whMacpA,QqujExXDuqc,EUROPA AL BORDE de la RECESIÓN y en ESTADOS UNIDOS puede LLEGAR en 2024 | con Pablo Gil
241,UCtJ_zVzWNALGZx8XmZW_Lgw,7WoGe2MeF_g,"El Consejo General de Economistas prevé que la economía española crezca entre el 5,6% y 5,8% en 2022"
242,UCQ1GpKa15ulyoQuxz7H4rng,Cw-qHZemygI,Geopolítica sobre los escombros de la Unión Soviética | DW Documental
243,UCQ1GpKa15ulyoQuxz7H4rng,AuXbnQjPsBQ,"Los ricos, los pobres y la basura | DW Documental"
244,UCba3hpU7EFBSk817y9qZkiA,v4SUw2eRdcs,La proyección sobre la economía Argentina para el 2023
245,UC3w8CudWka6yenAHzGGLK_g,r32dktDWog0,"Banca y reputación, cómo ha evolucionado la economía española en los últimos años"
246,UCsT0YIqwnpJCM-mx7-gSA4Q,NPE7i8wuupk,"¿Por qué me vigilan, si no soy nadie? | Marta Peirano | TEDxMadrid"
247,UCPH3Oz99Y_jrVBCQMjQZNSg,PPFhiH3KJoA,🔥 La CRISIS del SÁHARA OCCIDENTAL en 8 minutos 🔥 | ¿Qué está pasando en el SÁHARA OCCIDENTAL?
248,UCbOH16rrpX0PPNSM831ugiw,O13n6VnsYkg,¿Qué tan importante es el crecimiento del PBI?
249,UCgHDhkmOpS7LOeseojWjzkQ,UOJOTnoCg8c,INFLACIÓN en ESPAÑA: situación económica actual 2022 | BARCELONA | Pame Otero
250,UCbOH16rrpX0PPNSM831ugiw,O13n6VnsYkg,¿Qué tan importante es el crecimiento del PBI?
251,UCgHDhkmOpS7LOeseojWjzkQ,UOJOTnoCg8c,INFLACIÓN en ESPAÑA: situación económica actual 2022 | BARCELONA | Pame Otero
252,UCUdOoVWuWmgo1wByzcsyKDQ,uyBUW2emzeM,Nayib Bukele cumple tres años como presidente de El Salvador con 91% de aprobación ciudadana
253,UCI6QcXatdaEAaRTRjl3dc0w,4kxCfXzsU_U,"V. Completa.  Sabiduría antigua para tiempos modernos. Mauro Bonazzi, filósofo y profesor"
254,UCwd8Byi93KbnsYmCcKLExvQ,2_iMYWgJe2g,El gobierno de España y sus lacayos mediáticos mienten: estos son los datos reales de su economía
255,UCtHL2QxQRsNI3Z0s9kiN_lw,T-3QWakJAzU,¿Qué es la economía del comportamiento?
256,UCUBIrDsIVzRpKsClMlSlTpQ,InLUR88QUXU,El origen del conflicto en el Sahara Occidental (y qué papel tiene España)
257,UCldGZzUfJhlOkONERIfdzmw,O8ioaTMLzX0,ECONOMÍA ESPAÑOLA 2023 👍 Actualidad económica ESPAÑA 📻 NOTICIAS economía España 2023
258,UCUIvPmpKsx-YnBRxc-E9IXg,MTkbdsncVMA,Modelos de Organización Económica (en 1 minuto)
259,UCTsJdoAYXyR40S-Jydn5MtA,1bwfnFryFwM,"🚀 Las 10 MEJORES IMPRESORAS para CASA, ESTUDIANTES y NEGOCIOS 💥 (2023) IMPRESORAS Calidad-Precio"
260,UCUBIrDsIVzRpKsClMlSlTpQ,LOgy5j2Z8vw,Cómo se desarrollaron los ataques del 11-S y qué consecuencias tuvieron | BBC Mundo
261,UC4Nd2eNT45ByX-N7u_zoRmg,CZubA1fzDRo,Perspectivas económicas de este 2023
262,UCCJs5mITIqxqJGeFjt9N1Mg,TA7_ibHPsoE,Los datos que evidencian los problemas de la economía española
263,UCT4Jg8h03dD0iN3Pb5L0PMA,ahB1wp9VsQE,Las noticias de economía más destacadas de la última semana
264,UC4Nd2eNT45ByX-N7u_zoRmg,nS3TdXGO5As,Retos para la economía mexicana en 2023
265,UCI6QcXatdaEAaRTRjl3dc0w,u2G5hSsC1UI,"Filosofía para cuestionar el mundo que nos rodea. José Carlos Ruiz, filósofo y profesor"
266,UCwZ6l0gbQFJJR_Jk6Vpdy_w,n-vcGcs7YBc,¿QUÉ ES EL NEOLIBERALISMO? / EXPLICADO FÁCIL
267,UCpFPwQOxBz6czUgNOC3dedQ,vygjEWWZ-zw,EL FEUDALISMO en 5 minutos
268,UCba3hpU7EFBSk817y9qZkiA,zp6liiLkMT8,Los pronósticos económicos para el 2023 en Argentina
269,UCBWF6OT9sHQU0rnMmUPdmyA,C8Qk5YSn9OI,"La EXPANSIÓN EUROPEA entre los Siglos XV y XVIII  | Portugal, España, Países Bajos, Francia..."
270,UCKC77AR_zWXRTE2GOD_2Uag,RhBqEwhnP4I,"🔴 DIRECTO 27/11/2023 - &#39;LA DECADENCIA DE LA EUROPA FAKE&#39;, con Lorenzo Ramírez"
271,UCJQQVLyM6wtPleV4wFBK06g,AUrtlvI0BK4,ARGENTINA: El país que CASTIGA las EXPORTACIONES - VisualPolitik
272,UCpLmi_jSAGGRXscQtSjSJrA,qS6XRd1NzIc,ECONOMÍA COLONIAL/VIRREINATO
273,UC4Nd2eNT45ByX-N7u_zoRmg,R3ep3D65cSw,México y la economía latinoamericana
274,UCT4Jg8h03dD0iN3Pb5L0PMA,ao1A1SzuyCU,Las principales noticias económicas de la semana
275,UCQ1GpKa15ulyoQuxz7H4rng,h24Bha4P3Uw,"Fe, poder, manipulación - Los secretos de la secta del Opus Dei | DW Documental"
276,UCldGZzUfJhlOkONERIfdzmw,d9u0oy7I9Z8,ECONOMÍA ESPAÑOLA 2023 👍 Actualidad económica ESPAÑA 📻 NOTICIAS economía España 2023
277,UCA6sFGbX-sCsV-e7mszTC3Q,iw7Yxx3j2T8,¿El Sistema EDUCATIVO FINLANDÉS es el MEJOR del Mundo? ¿Cuál es su SECRETO?
278,UCi7B3XBQ5NswO-tawUGMCOA,D1-6kPdxJBs,"Economía, finanzas y política (resumen semanal 03-12-2023)"
279,UCkcpcQv9rKFqWRO5ocqKZPg,jw0-H2S5eT4,Documental Económico | Español | Cómo el dinero dejó de tener valor | Política Monetaria
280,UCUBIrDsIVzRpKsClMlSlTpQ,hKsnANzUbqo,"El Esequibo, el territorio que enfrenta a Venezuela y Guyana desde hace casi dos siglos | BBC Mundo"
281,UCwd8Byi93KbnsYmCcKLExvQ,-n51oKZDriY,"NOTICIAS ECONÓMICAS: Qué pasa en el mercado inmobiliario, EEUU necesita a China y desastre en España"
282,UCGeCSS6g1D7rv2LppDXcAdg,d7AgE6LcXTA,No hay nada más caro que lo gratis | YOKOI KENJI
283,UCBWF6OT9sHQU0rnMmUPdmyA,L-IjlWYMfMI,El ABSOLUTISMO - Resumen |  Las Monarquías Absolutas entre los Siglos XVI y XVIII
284,UCldGZzUfJhlOkONERIfdzmw,OXjEYnK4-n0,ECONOMÍA ESPAÑOLA HOY | Actualidad económica ESPAÑA | Resumen económico de la semana 📻 😃
285,UChKaP95xc8j0J4h2MXjP1yQ,G6C90SNyiJA,Cómo Israel se Convirtió en el País más Avanzado en Agricultura
286,UCpFPwQOxBz6czUgNOC3dedQ,PIjV90q36TU,REFORMAS BORBONICAS en minutos
287,UCldGZzUfJhlOkONERIfdzmw,ivt6Wp3-NTk,ECONOMÍA ESPAÑOLA 2021 😃 Actualidad económica ESPAÑA | Resumen económico de la semana 📻 Economía HOY
288,UCUBIrDsIVzRpKsClMlSlTpQ,BKNQNzyRydw,¿Cómo sería México si Estados Unidos no se hubiera apropiado de más de la mitad de su territorio?
289,UCPH3Oz99Y_jrVBCQMjQZNSg,90H1JvKT5tI,✅ La HISTORIA DE ESPAÑA en 15 minutos | El RESUMEN definitivo
290,UCba3hpU7EFBSk817y9qZkiA,MUf4IFYdLZY,Bukele acelera en la lucha contra la inseguridad: &quot;Metemos a los delincuentes en las cárceles&quot;
291,UCwd8Byi93KbnsYmCcKLExvQ,W6IfW98kEV0,Situación económica actual de España | Negocios TV
292,UCJQQVLyM6wtPleV4wFBK06g,-4pB1PSklCk,¿Por qué GIBRALTAR es el lugar más EXITOSO de EUROPA? - VisualPolitik
293,UCT4Jg8h03dD0iN3Pb5L0PMA,XpqXjUS60_g,Las principales noticias económicas de la semana
294,UCWr27deg7PBV947FGHGD2cw,krRY_JKxDO4,Piramide de Maslow Jerarquía de Necesidades Humanas
295,UCT4Jg8h03dD0iN3Pb5L0PMA,4QNG359q20k,Las principales noticias económicas de la semana
296,UCldGZzUfJhlOkONERIfdzmw,lxeN3eWgxXU,ECONOMÍA ESPAÑOLA 2023 👍 Actualidad económica ESPAÑA 📻 NOTICIAS economía España 2023
297,UCtaplouazsQkJEI7pkimrGw,wZagDgpkMbE,DOCTRINAS O ESCUELAS ECONÓMICAS (RESUMEN)
298,UCyM-2pRapEv6V2q7UNO9icg,_BWmhWd6YmY,👚 El hombre que inventó la MODA RÁPIDA | Caso Zara
299,UCUBIrDsIVzRpKsClMlSlTpQ,xhD0-FlAjRU,Novak Djokovic revela a la BBC por qué no se ha vacunado contra la covid | BBC Mundo
300,UCWr27deg7PBV947FGHGD2cw,krRY_JKxDO4,Piramide de Maslow Jerarquía de Necesidades Humanas
301,UC2SEk1w7DgoHs_G3w1biz-w,IYE1qwqV0wE,Chocan Alfredo Jalife y Hernán Gómez en entrevista
302,UC7QZIf0dta-XPXsp9Hv4dTw,AeAE-IwWbc8,"BANCO DE ESPAÑA: MEJORA sus PREVISIONES para 2023, pero los ALIMENTOS seguirán SUBIENDO | RTVE"
303,UCwd8Byi93KbnsYmCcKLExvQ,gj0lXcFoCgk,Última hora: El INE desmiente sus propios datos: La economía española se desplomó más de lo previsto
304,UCUBIrDsIVzRpKsClMlSlTpQ,8urGTdEioOQ,La física cuántica explicada en menos de 5 minutos | BBC Mundo
305,UCpFPwQOxBz6czUgNOC3dedQ,yM3S8qRt8Bs,EL VIRREINATO DEL PERÚ en minutos
306,UC4Nd2eNT45ByX-N7u_zoRmg,r-HxaVRYOH8,"Alfredo Jalife, especialista en relaciones internacionales"
307,UCUBIrDsIVzRpKsClMlSlTpQ,bRI5--UmHxo,La compleja frontera entre República Dominicana y Haití
308,UCv05qOuJ6Igbe-EyQibJgwQ,hYajgwcWb1k,El nacimiento del Estado Moderno en 15 minutos
309,UC_LlsgVEUKixJSGAKakQ7zQ,bho890XeAs4,HISTORIA DEL PENSAMIENTO ECONÓMICO - HISTORIA DE LA ECONOMÍA.
310,UCyoGb3SMlTlB8CLGVH4c8Rw,RUIKxDwXnRM,"Harari: &quot;Por primera vez en la historia, los ricos serán una especie diferente a los pobres&quot;"
311,UCUBIrDsIVzRpKsClMlSlTpQ,HJFAoUU2alE,"La Gran Depresión, la crisis económica con la que comparan a la del coronavirus"
312,UCtfUtBf-iidvog2b-T1a1Ig,rHLqMiumdBo,Las 7 MEJORES MOTOS! (accesibles) para LA CIUDAD! 2022
313,UCJQQVLyM6wtPleV4wFBK06g,ZKGkLZ-IgjI,¿Tiene ARGENTINA la POLÍTICA más CARA del mundo? El paraíso de los políticos - VisualPolitik
314,UCX16cLWl6dCjlZMgUBxgGkA,WWNkMW9Pfl4,¿El ANARQUISMO busca el caos?
315,UCzcoo0Y7gPECXF46oDo4omA,-Zy2nRLBZRA,En Chile elogian economía peruana
316,UCT4Jg8h03dD0iN3Pb5L0PMA,mEZKKq-pPPc,"La economía china crece un 4,5% en el primer trimestre"
317,UCPH3Oz99Y_jrVBCQMjQZNSg,zhLBGsHw9fQ,🔵⚪La HISTORIA ARGENTINA en 14 minutos🔵⚪| Resumen fácil y rápido
318,UCF6esJCfXiwvCTnpr1XYJGQ,HU2ED9EasTI,Agentes económicos
319,UCEXDCxwktpMMFhTSGdEP3EA,Q1vxOdAb3Uc,¿Debe intervenir el Estado en la economía?
320,UCpFPwQOxBz6czUgNOC3dedQ,0QoxeOYtnOw,EL IMPERIALISMO en 6 minutos
321,UCKC77AR_zWXRTE2GOD_2Uag,QtDihKm2S4I,¿POR QUÉ NOS OCULTAN LO QUE VA A PASAR? - Vlog de Marc Vidal
322,UC3bRVqfLpexxvzmoIyYc-KQ,w2fpjnwNi7Q,✅ ¿Por qué LATINOAMERICA es MÁS POBRE que ESTADOS UNIDOS y CANADÁ? ¿Y cómo puede dejar de serlo?
323,UCrnJVY1M2rNInAQu12iE0kg,X3AueSrzSvs,Conferencia “El fin del exceso monetario. Perspectivas económicas ante el final del dinero barato”
324,UCQ1GpKa15ulyoQuxz7H4rng,A3cGMNxRNJ0,"Google, Facebook, Amazon - El poder ilimitado de los consorcios digitales | DW Documental"
325,UC1LfL-CxMzKffOf9kcqMUbQ,bvoEniq4GlA,Perspectivas Económicas del Perú al 2023
326,UCS0NS59xupxYKvx_uyqnRSA,wXcE3Q1uxeY,"Prevemos que el crecimiento de la economía española será del 4,1% en 2022 y del 1,8% en 2023"
327,UCPH3Oz99Y_jrVBCQMjQZNSg,XLYB-GRE6Fk,"✅ La CONQUISTA y COLONIZACIÓN española de AMÉRICA | Historia, mitos, verdades, leyenda negra..."
328,UC5d5wLi2Feyd3FrBNyeEPgw,_W9hcIlj7aA,Hannah Arendt
329,UCPH3Oz99Y_jrVBCQMjQZNSg,Y6JZy7W5-c0,¿Por qué COREA DEL SUR es tan RICA? | ¿El mayor MILAGRO ECONÓMICO de la historia?
330,UCT4Jg8h03dD0iN3Pb5L0PMA,IwwG3HA6XAA,Las noticias económicas más destacadas de la semana
331,UCLNtqR-TsG_2QScndNb8xhA,DqJh_7jNx8o,"Economía de México (1940-1982), características y modelos económicos aplicados."
332,UCjxeK_mixc2-AvWUSmqe1gg,myqYO7I6MBA,¿Usted es de izquierda o derecha?
333,UCBWF6OT9sHQU0rnMmUPdmyA,JKFCVTETfxU,"La ÉPOCA COLONIAL en Hispanoamérica - Resumen | Organización Política, Económica y Social."
334,UC_lEiu6917IJz03TnntWUaQ,0GtGdjN8YDo,"“Hay buenas noticias y retos para la economía de 2023”, dice experta"
335,UCevif8Yk47cJKrq4-0EmwIA,PTpCZqCnPBg,Estado de la economía tras la pandemia
336,UC1IYhBFQbBWIxirTRbcfIUw,tcgOGqhQFT4,Federico a las 7: Dos varapalos del Poder Judicial a Pedro Sánchez
337,UCba3hpU7EFBSk817y9qZkiA,AeFSyQrs7Wg,"El análisis de la transición previa a la asunción de Milei, en el pase entre Pablo Rossi y Feinmann"
338,UC40FZRPiODzhhuJA77M01xA,LmykvQeKKZo,¿4.200.000 en casi 30 años? La gran inmigración en Argentina (1880 a 1914)
339,UCwd8Byi93KbnsYmCcKLExvQ,tQqi7E_eheE,"Diagnóstico BBVA Research: la economía española lo hará mejor de lo esperado, apoyado en la demanda"
340,UCv05qOuJ6Igbe-EyQibJgwQ,EXijvhBQ-u8,La Guerra Fría en 7 minutos
341,UCQ1GpKa15ulyoQuxz7H4rng,X8vvfTyQoMY,New Work: una nueva forma de trabajar | DW Documental
342,UCI6QcXatdaEAaRTRjl3dc0w,Z3_f6a-YrY8,"Versión Completa: Victor Küppers, El valor de tu actitud"
343,UCKC77AR_zWXRTE2GOD_2Uag,Yt88QMqz8Ug,IRLANDA EXPLOTA CONTRA LA INMIGRACIÓN IRREGULAR - Vlog de Marc Vidal
344,UC7QZIf0dta-XPXsp9Hv4dTw,HjZNFjKLdvo,El FMI prevé que el DÉFICIT de España se mantenga POR ENCIMA del 4% del PIB hasta 2027 I RTVE
345,UCAi8NxVIpYcotCeJGQ2XsQA,jm0hTje0ono,Tips Importancia de la economía familiar
346,UCoZgBjCPsHE8Qds1kEPLDgQ,r6iSyodauN4,La propuesta de la ESCUELA AUSTRIACA para eliminar los ciclos económicos
347,UCUdOoVWuWmgo1wByzcsyKDQ,6BEehShm81s,Haití-República Dominicana: una isla dividida • FRANCE 24 Español
348,UCUP6qv-_EIL0hwTsJaKYnvw,9d6Zx4Yl678,En China la gente ya no quiere tener HIJOS; el Gobierno enfrenta una CRISIS poblacional
349,UCT4Jg8h03dD0iN3Pb5L0PMA,qgsbZFSPj_I,DW Noticias 26 de noviembre: Nuevo canje de prisioneros abre la puerta a extender la tregua en Gaza
350,UCwd8Byi93KbnsYmCcKLExvQ,tQqi7E_eheE,"Diagnóstico BBVA Research: la economía española lo hará mejor de lo esperado, apoyado en la demanda"
351,UCv05qOuJ6Igbe-EyQibJgwQ,EXijvhBQ-u8,La Guerra Fría en 7 minutos
352,UCI6QcXatdaEAaRTRjl3dc0w,Z3_f6a-YrY8,"Versión Completa: Victor Küppers, El valor de tu actitud"
353,UCKC77AR_zWXRTE2GOD_2Uag,Yt88QMqz8Ug,IRLANDA EXPLOTA CONTRA LA INMIGRACIÓN IRREGULAR - Vlog de Marc Vidal
354,UCjErQRyO2Q3ZeFppo2STFXQ,cwMzjrkRp2E,💣 ¡Caída en la ECONOMÍA Mundial! 👉 ¿RECESIÓN? | La OCDE opina sobre crecimiento e INFLACIÓN
355,UCAi8NxVIpYcotCeJGQ2XsQA,jm0hTje0ono,Tips Importancia de la economía familiar
356,UC7QZIf0dta-XPXsp9Hv4dTw,HjZNFjKLdvo,El FMI prevé que el DÉFICIT de España se mantenga POR ENCIMA del 4% del PIB hasta 2027 I RTVE
357,UCoZgBjCPsHE8Qds1kEPLDgQ,r6iSyodauN4,La propuesta de la ESCUELA AUSTRIACA para eliminar los ciclos económicos
358,UCUdOoVWuWmgo1wByzcsyKDQ,6BEehShm81s,Haití-República Dominicana: una isla dividida • FRANCE 24 Español
359,UCI6QcXatdaEAaRTRjl3dc0w,1QP5QzqdU2M,"Por qué la música es tan importante en nuestra vida. José Manuel Zapata, tenor."
360,UCUP6qv-_EIL0hwTsJaKYnvw,9d6Zx4Yl678,En China la gente ya no quiere tener HIJOS; el Gobierno enfrenta una CRISIS poblacional
361,UCT4Jg8h03dD0iN3Pb5L0PMA,qgsbZFSPj_I,DW Noticias 26 de noviembre: Nuevo canje de prisioneros abre la puerta a extender la tregua en Gaza
362,UCmJL2llHf2tEcDAjaz-LFgQ,sYfYfuJZD5s,"Powell no asusta y sigue la tendencia alcista  Cierre 1 12 23 bolsas, economía y mercados"
363,UCPH3Oz99Y_jrVBCQMjQZNSg,gG_OPH0qFiM,✅ La PESTE NEGRA en 10 minutos: la MAYOR PANDEMIA de la historia
364,UCzuUopbwNh8Sl5OcYsVgRjw,s15k9Eo8pPQ,💡 EL INVERSOR INTELIGENTE de Benjamin Graham: RESUMEN animado del libro en Español | RESEÑA 2021
365,UCLUIBbVtWiasoxR5tLNFPDg,X77keXtIb6Y,Panorama de la economía  colombiana para 2023
366,UCTXNz3gjAypWp3EhlIATEJQ,eWg1uQzRzhw,"Académico por economía de Chile: &quot;No solamente no estamos creciendo, sino que se está contrayendo&quot;"
367,UCKC77AR_zWXRTE2GOD_2Uag,pzTdAO0o65c,CUATRO CLAVES FUTURAS DE LA ECONOMÍA DOMESTICA - Vlog Marc Vidal
368,UCUBIrDsIVzRpKsClMlSlTpQ,gcPQE4QeRpc,Concordia: la ciudad argentina donde cada vez hay más familias que viven y comen de la basura
369,UCv05qOuJ6Igbe-EyQibJgwQ,V1zdeV-q5u8,La Reforma protestante y Lutero
370,UCT4Jg8h03dD0iN3Pb5L0PMA,mdfLTe5WKjY,Alemania lucha por mantenerse en la carrera por la competitividad y sostenibilidad | A fondo DW
371,UCvYgy9xNtl7jeJAdzppgK8g,On1P-KdiCBg,Agentes Económicos | Economía
372,UCQQIaox9k-nz1GaGdDcTq2g,IhdqM0VNnY8,ENTENDER el CONCEPTO de ESCASEZ en la ECONOMÍA | Escasez y Economía
373,UCbrheQLVZwj8Ac1ZMeSEKlA,-2GmvUD41KM,&quot;Diálogos Sobre Economía: ¿Los Argentinos Somos Liberales?&quot;
374,UCT4Jg8h03dD0iN3Pb5L0PMA,-13cl28FCUY,Se dispara la inflación en Argentina
375,UCA2_B_86jWZ5UYB0hMnsMBg,2ibic0nrbBk,🚨 Elon Musk: QUE OS DEN POR CUL*! 🚨 Cifras Inflación ⚠️ Cybertruck 🔥🔥 AMZN GOOG SNOW CRM OXY NFLX 🔴
376,UCvmXCP4_uD4Imt8npcFXZ4A,Ob3lfOvXZRw,¿Cómo estará la economía en 2023? Así lo ven los eurodiputados españoles
377,UCwd8Byi93KbnsYmCcKLExvQ,7vWTID9fhvc,"NOTICIAS ECONÓMICAS | ¿Cuándo bajarán las hipotecas?, Alemania avisa de “tiempos duros” y la OPEP"
378,UCoMWImnPAur6JhXDK63dpAg,sOlbVPBW3Gk,Málaga 24h TV - De Guindos ve &quot;muy difícil&quot; que la economía española crezca por debajo del 3%
379,UCqmZBc7T8J5TFuRT5uf-j_g,ju7G3Q97Lv8,Presente y futuro de la economía argentina
380,UChmLIRBQh3-bRJp3d6Dnnog,xMKv5-8MVpE,La REVOLUCIÓN FRANCESA | Draw My Life
381,UCyoGb3SMlTlB8CLGVH4c8Rw,H3A5ufBhcT8,Foro Económico de Bruselas 2023: Cuál es la situación de la Unión Europea y hacia dónde se diri…
382,UC3M7etsNlrinTzT6kJj_XgQ,e9v0uE7Rmmo,Panorama Económico de Costa Rica en el 2023. Gerardo Corrales
383,UCv05qOuJ6Igbe-EyQibJgwQ,yj9N9DTtdas,La Guerra Civil española
384,UC7RfsjxXNNBltx8VpX1RsJw,4OidqHRwE-w,Tipos de economía
385,UCL5IteTsd_BtDipFuKsoDjA,DXMes_GEvbc,Sectores económicos
386,UCldGZzUfJhlOkONERIfdzmw,O-Uu45d-T5o,ECONOMÍA ESPAÑOLA HOY - Programa del 20/11/2020 📻 Radio Intereconomía Asturias 🐂
387,UCT4Jg8h03dD0iN3Pb5L0PMA,23_0yPHmrDM,&quot;Sodoma y Gomorra&quot; en África
388,UC1IYhBFQbBWIxirTRbcfIUw,K0RB78dZlYk,Tertulia de Federico: El nefasto viaje de Sánchez a Israel y las consecuencias para España
389,UCUS73_bjTYwBFAfXbvIjM8Q,kO8V6ITYQmE,¿Por qué España es humillada económicamente?
390,UCI6QcXatdaEAaRTRjl3dc0w,ERRpg_FEMck,"V. Completa ¿Qué ha sido del bien común? Michael Sandel, filósofo y profesor"
391,UCwd8Byi93KbnsYmCcKLExvQ,k1sX_5mXuOg,El desastre económico de España y los secretos de Lacalle para invertir con sentido. Money &amp; Markets
392,UCpFPwQOxBz6czUgNOC3dedQ,U4X_DSkXqi4,EL HUMANISMO en  5 minutos
393,UC2Xq2PK-got3Rtz9ZJ32hLQ,q2ixU7In8p4,¿Cómo se definirá el ajuste del salario mínimo en Colombia para 2024?
394,UCRKTMdWCcIhyn05o9ousD_g,8sLoRZqs7k8,No vayas a NUEVA YORK sin saber esto 2023 | Guía Nueva York 2023
395,UCI6QcXatdaEAaRTRjl3dc0w,co_F_zYqnEQ,"Versión Completa: La utilidad de lo inútil en nuestra vida. Nuccio Ordine, profesor y escritor"
396,UCLUYU7iIX2jC7XUrqR9My_g,5PdXNVmTuWs,6- Economía. S2. Teoría keynesiana.
397,UCQ1GpKa15ulyoQuxz7H4rng,6qZsz4vtvzw,¿Es posible acabar con las redes criminales de alcance global? | DW Documental
398,UCrdGjkqTZVMmAOk4YDjFV-w,9i5-7rD2_W4,"¡La economía, idiotas! ¡42 años arruinando España!"
399,UCDsEV6BQnhCwGd1F7Wc9wDg,oJkXaGKwrU0,#VersusDePaíses | España vs. Italia | Economía y calidad de vida
400,UCzDmu6QviXbf0cbeFBh2_zA,0Arz33KppKk,LA HISTORIA DE LA ECONOMÍA en 10 minutos ⏳💰
401,UCldGZzUfJhlOkONERIfdzmw,0aaGWDSoY0I,ECONOMÍA ESPAÑOLA 2022 👍 Actualidad económica ESPAÑA | Resumen económico de la semana 📻 Economía HOY
402,UCpFPwQOxBz6czUgNOC3dedQ,5hIMznobmEY,LA BURGUESÍA en minutos
403,UCUBIrDsIVzRpKsClMlSlTpQ,DMc2q2Fxo5A,Pedro Castillo presidente electo de Perú: en qué se basa su plan de economía popular con mercados
404,UCUdOoVWuWmgo1wByzcsyKDQ,FM-zFcqn2KA,El resumen de las noticias económicas de la semana con Jorge Hurtado
405,UCPjHTxNqLHkzolwskEhbXQA,yU1X2oooBHU,EP 62 - &quot;ESTO APRENDÍ AL HABER FUNDADO UN BANCO&quot; / CON PERAS Y FINANZAS
406,UCT4Jg8h03dD0iN3Pb5L0PMA,-Xa5BIzxCq8,Las principales noticias económicas de la semana
407,UCUBIrDsIVzRpKsClMlSlTpQ,nyDDFsPojPQ,Cómo perdió Bolivia su salida al mar ante Chile (y en qué le afecta realmente)
408,UCcg9REbuc0v9jIdDii2mX4w,oGbnwFWleJI,La situación económica y política de Bolivia
409,UCykHSUQsPffTBmJvUlimeqw,6ohzCfyWhsg,Punto de Equilibrio - Perspectivas de la Economía Peruana para el 2022
410,UCcH3aydyR7QygJ25-6EDeAg,4tNxhZTDhdg,Polémica por conversatorio en Facultad de Ciencias Económicas sobre seguridad social
411,UCsT0YIqwnpJCM-mx7-gSA4Q,R7wUI2hAgvU,El poder de la disciplina | Gabriel Batistuta | TEDxEstaciónEwald
412,UCKK0q0_sDnfguNQ9WN2qjRQ,MHO3oUExoGE,CONSUMO RESPONSABLE
413,UCT4Jg8h03dD0iN3Pb5L0PMA,-2ByhYNSnqI,Migrantes quedan a la deriva por nuevo plan migratorio de Estados Unidos
414,UC-yJ1V3fN75A4dlR6dgRgEg,Y2wgpnUXnBk,❌ No INVIERTAS en BOLSA sin ANTES SABER ESTO |👉 REVELO las 5 ESTAFAS más PELIGROSAS
415,UCT4Jg8h03dD0iN3Pb5L0PMA,qlx0AtmntTM,Deutsche Bank desata el pánico financiero
416,UCI6QcXatdaEAaRTRjl3dc0w,QTy-Q2GJBv4,"V. Completa. La importancia de ser como quieres ser. Tomás Navarro, psicólogo y escritor"
417,UCBWF6OT9sHQU0rnMmUPdmyA,jHoeKSFs5LI,Historia de la Esclavitud - Resumen
418,UCoMWImnPAur6JhXDK63dpAg,sOlbVPBW3Gk,Málaga 24h TV - De Guindos ve &quot;muy difícil&quot; que la economía española crezca por debajo del 3%
419,UCUS73_bjTYwBFAfXbvIjM8Q,cht74hGvZMY,El Programa de Cuesta: El plan de Sánchez contra los jueces antiamnistía y la frutera Yolanda Día
420,UCQ1GpKa15ulyoQuxz7H4rng,nwNVrRFTeH0,El País Vasco y la ETA | DW Documental
421,UCpFPwQOxBz6czUgNOC3dedQ,FC19rWLff1w,EL ABSOLUTISMO en 5 minutos
422,UCT4Jg8h03dD0iN3Pb5L0PMA,tXTMjp7KCOg,El Salvador | Aplausos y críticas al presidente Bukele
423,UC3loD3RAic8B5S90ytaGUXw,zSRjToF864c,Organización Colonial
424,UC2J5N-sGHGc1K9WLz76P2YA,diKCsbYSH3s,$2.000 DOLARES SEMANALES limpiando cuartos ( Trabajo en Australia)
425,UCe04maP4YHNTAPayUBIl2Fg,5-tCJobWwU8,"Boomers, X, millennials, Z y ahora hasta los &#39;alfa&#39;: así se crean las generaciones"
426,UCA1aO_B4sCazFQDl8mxPdvA,eOb1oQSDJxU,Qué es la INTERVENCION ESTATAL
427,UCqvaXJ1K3HheTPNjH-KpwXQ,npoNbXXS4oQ,"Cómo funciona la máquina económica, por Ray Dalio"
428,UC38i3EyAQYHQDYlcUzRqaAQ,IS3yTxP6EEk,Cómo redactar un TEXTO ARGUMENTATIVO de manera fácil | Consejos para leer y escribir mejor
429,UCPH3Oz99Y_jrVBCQMjQZNSg,LmqJoY_qxyQ,✅ ¿Qué está PASANDO en KOSOVO? | El Conflicto entre Kosovo y SERBIA en 10 minutos
430,UCnKlfDXaVP-6uIACOJeVPfw,TpuZUQYeB-g,🔴 La ILUSTRACIÓN del SIGLO XVIII en 5 minutos ‼
431,UCI6QcXatdaEAaRTRjl3dc0w,imrNJZwmY0g,"La educación es la puerta de las oportunidades. Carlos Torres Vila, presidente de BBVA"
432,UCv05qOuJ6Igbe-EyQibJgwQ,QPnwSnNMZMY,Napoleón Bonaparte y las guerras napoleónicas
433,UCUBIrDsIVzRpKsClMlSlTpQ,Tp_aP5MRVvE,Huáscar: el barco que divide a Chile y a Perú | BBC Mundo
434,UCcD80HsrGnazgQnba7DLxtQ,jKJLqw0puuI,Economía argentina durante la Dictadura Militar de 1976 - MIE
435,UCpFPwQOxBz6czUgNOC3dedQ,h3hTGJThmuo,¿QUE ES LA SOCIOLOGÍA?en minutos
436,UC87dLIiv-q1S_D1YXej_Xtg,_h1BIPs9zQg,La DISCRIMINACIÓN | TIPOS o CLASES de discriminación | Explicación y Ejemplos.
437,UCUS73_bjTYwBFAfXbvIjM8Q,DHTUAEfEjU0,Sánchez censura el discurso de Navidad del Rey
438,UC7QZIf0dta-XPXsp9Hv4dTw,cFPJATMjCMQ,Así viven la GUERRA los UCRANIANOS y RUSOS que viven en ESPAÑA | RTVE Noticias
439,UCBLCvUUCiSqBCEc-TqZ9rGw,Y8qmpJbDe90,¿Tendrán pensión los autónomos?
440,UCQ1GpKa15ulyoQuxz7H4rng,34Kz-PP_X7c,¿De qué es capaz la inteligencia artificial?  | DW Documental
441,UC8E_HXo-im1b_NLzmG8vXuw,zk8tbcIatl4,Las 3 noticias económicas de la semana
442,UCpFPwQOxBz6czUgNOC3dedQ,Ffwhjv1qiPA,LA INDEPENDENCIA DEL PERÚ en minutos
443,UCT4Jg8h03dD0iN3Pb5L0PMA,XC5PmFmFl5k,La desinformación en la invasión rusa a Ucrania
444,UCNd09h2GugrdeT_80LxOFMw,XwWF5hkEXOw,Un gran debate sobre la economía peruana en este 2023
445,UCsRnhjcUCR78Q3Ud6OXCTNg,-rkqfARwAVU,Alberto Fernández: México y Brasil ofendidos por dichos del Presidente de Argentina
446,UCE3m5uW9fUnf_tuKsVAmVPw,-UFFFUTMlCw,¿Por qué el Reciclaje es tan Importante? | Videos Educativos Aula365
447,UCBdq2IZdl8bp1OOg5BNawuQ,ZCukFgCcLY0,MÉXICO INDEPENDIENTE - MÉXICO DESPUÉS DE LA INDEPENDENCIA
448,UCAMKTtcWpjjeKJnmWytLfZQ,v_Dt_eTM1Y8,Hidrógeno para el automóvil ¿será la solución? / Review en español | coches.net
449,UChmLIRBQh3-bRJp3d6Dnnog,X6mmqGuen9s,La ESCLAVITUD ⛓ | Draw My Life en Español
450,UCxF6eYjLhx-vmeyPUB-GqIg,bF90J7OdWhs,Previsiones económicas para España 2022-2023
451,UCUBIrDsIVzRpKsClMlSlTpQ,d1kdOny_ufM,"Cómo fue la Gran Colombia, la ambiciosa república que dio lugar a 4 países de América Latina"
452,UCBWF6OT9sHQU0rnMmUPdmyA,UVmS_dWcWEk,"La ILUSTRACIÓN - Resumen | Las Ideas de Voltaire, Montesquieu, Rousseau..."
453,UCQ1GpKa15ulyoQuxz7H4rng,IZubgY5ZI5Y,Las raíces históricas de los nazis modernos | DW Documental
454,UC1HvpdtJ-d90_wIY_ZfaTXQ,iWOKRh_y970,Metodología de la Economía
455,UCAMKTtcWpjjeKJnmWytLfZQ,8cW7jPP8lRQ,PEUGEOT 3008 SUV | Prueba / Test / Review en español | coches.net
456,UC7QZIf0dta-XPXsp9Hv4dTw,aktUWLOKirw,EE.UU.: El PENTÁGONO estudia 400 OVNIS o FENÓMENOS que &quot;NO pueden EXPLICAR&quot; | RTVE Noticias
457,UCnsvJeZO4RigQ898WdDNoBw,EkqJlyJNLGQ,La cuesta de septiembre: tirar de ahorros y comer de táper | PODCAST Hoy en EL PAÍS
458,UCUBIrDsIVzRpKsClMlSlTpQ,px0O47pdlpw,Los 3 países de América Latina cuyas monedas más se han devaluado frente al dólar
459,UCIvqcSPbzQBynjq230v9_yw,Zy_vED1bQYQ,Retos y perspectivas económicas ante el 2023: La situación española ante el 2023
460,UCgs55420lnbnDWdyIpZmM1g,qICUkfDnETE,💥👎 Bruselas CRITICA el informe económico de España y vuelve a reducir las previsiones de CRECIMIENTO
461,UCLN2yXoHn-tYuaXHvLIdVrw,qdXk6HK8Tvo,¿Qué es la interculturalidad?
462,UC0i4456b4Ypr_YqiMkPzc-Q,I9liHY-SjUI,🔴 ¿INVERTIR EN PAYPAL? ¿OPORTUNIDAD ÚNICA EN LA VIDA O TRAMPA?
463,UCVrbcg8FYyRhGSYn-fpiI0Q,-ECAlrfmjgg,Porqué Perú vende aguacate más barato.
