,canal_ID,video_ID,video_Title
464,UC9d2KgZ0XZiR2Zil51he4rg,kLe3R-pajf0,Friedman vs Keynes vs Lucas - Que Politicas Economicas son acertadas en el contexto actual?
465,UC6dTmpLOPRHZFQKhIxJtCbQ,X6my8lGA-hE,CUADRO COMPARATIVO
466,UC_lEiu6917IJz03TnntWUaQ,3L3FO83HIYY,¿Está Europa en un momento económico complicado? Experto opina
467,UCHG6C1muw-TTRy3P9DV899w,qYWBhFbN-zs,Métodos para evaluar los riesgos
468,UChojFzThpgObGHmdMS1rpvA,QOUjZUttDTs,La ContraRéplica - Peronismo y socialdemocracia en Argentina
469,UC2vTgblwTSRMtH-aoY7dvtQ,v7c95sNNcDw,¿Necesitas un dentista profesional y confiable cerca de ti? Ve esto.
470,UCTzU4wbpiyhxyDbI_433OkA,PkNrRvd6HMU,📈 #BOLIVIA en 5 minutos - Economía
471,UC7AD9VRZ9SPf-U5w6g9USKA,5IXny_vv8XA,Cómo hacer una buena introducción de un ensayo
472,UCX16cLWl6dCjlZMgUBxgGkA,7R2EqwkyE3s,¿De dónde viene y qué es el FASCISMO?
473,UCbOH16rrpX0PPNSM831ugiw,-E78TdlhZUM,¿Cómo recuperarnos de la actual crisis económica?
474,UCkrdLzJ3zMSGQ-OFNT2JrUQ,1R6AfgH2io8,"Vídeo Encuentro AATT &quot;La empresa familiar reactivando la economía española&quot;, 5 6 2020"
475,UCnKlfDXaVP-6uIACOJeVPfw,JClVMBd4eQQ,📕 Las CORTES de CÁDIZ y la CONSTITUCIÓN de 1812 | RESUMEN
476,UCpFPwQOxBz6czUgNOC3dedQ,3jcSBEJQo_A,EL VIRREINATO DEL RIÓ DE LA PLATA en minutos
477,UC-iFyyBBrgROltm-Lxk2mrw,9Y7fzalZH3I,La economía de Europa en el siglo XVI
478,UCT4Jg8h03dD0iN3Pb5L0PMA,xYPDZB-gM4Y,"Tras un año, la sociedad rusa en su mayoría respalda la guerra contra Ucrania | A fondo DW"
479,UC3loD3RAic8B5S90ytaGUXw,fKu0hZdudVc,Reformas Borbónicas
480,UCnGka8pYQ9FeUxazEPGki6g,UV0hPwVNvls,"Cálculo del PIB por el método gasto, ingreso y valor añadido (ejercicio resuelto)"
481,UCv05qOuJ6Igbe-EyQibJgwQ,N8S1s7B70Ak,La expansión del islam
482,UCQ1GpKa15ulyoQuxz7H4rng,XASh05novOI,La diabetes - Una enfermedad lucrativa | DW Documental
483,UCzsthLcm0x9BC5_WBcjtBZQ,HJJwNJgFXf0,El Problema de Inflación que tendrán Europa y EEUU I ¿Y por qué afectará a LATINOAMÉRICA y ESPAÑA?
484,UC32TdiIsh_5X8tKr_9rKQyA,YU5nmIZ5AAk,Ni las iglesias podrían ayudar a inmigrantes: los detalles de la nueva ley antiinmigrante de Florida
485,UCQ1GpKa15ulyoQuxz7H4rng,ux547wpA0dc,China - ¿Estado policial o laboratorio del futuro? | DW Documental
486,UCQ1GpKa15ulyoQuxz7H4rng,qGQwvd6bd1I,Multitasking - ¿Cuánto se puede hacer al mismo tiempo? | DW Documental
487,UCBs8DzPNGr9JHeQQYjzm1RA,1VDaOPzQ1sk,Cómo Aprobar Sin Estudiar un Examen con 5 TRUCOS y Tips para Pasar Sacar Preparatoria o Selectividad
488,UCCH8V6PoWLfNjEh2wzCBxCw,YAW3_80WRTY,Diversificar la economía #petropresidente
489,UCpFPwQOxBz6czUgNOC3dedQ,GAXkXoNv3UY,EL PLAN MARSHALL en minutos
490,UC9eCLBSj2fCYUsnMuelRloQ,9BmZJwA2Tjk,Así era la educación durante la dictadura franquista | Franco. La vida del dictador en color
491,UCGWt3Hunyq2i8Qso_de8x5g,W27DArY0hOI,"Comisión de Economía, Hacienda y Presupuesto. 01 dic 23. 19:00h Sección 17"
492,UCWzQmDWp_mjh3AOzPCZNzEQ,ApF4H5FnvE0,[FISIOCRACIA Y LIBERALISMO CLÁSICO] 👉 Las nuevas teorías económicas del XVIII
493,UCRwA1NUcUnwsly35ikGhp0A,kzvWOxoVJQM,"Nueva megacárcel de Bukele recibe a los primeros 2,000 reos | Noticias Telemundo"
494,UCq4MDyTCxz8peOTx3x789Qw,7ICLIQy8Wpw,¿Por qué los millennials no van a tener casa propia?
495,UCBWF6OT9sHQU0rnMmUPdmyA,WeVIhWd_eIk,¿Cómo se formaron las Primeras CIVILIZACIONES? - Resumen | El Surgimiento de la Civilización.
496,UCiainw2zaqFSub_fni3qZ7g,HMAv2kZr5yI,Los 3 sectores sociales en economía
497,UCUIvPmpKsx-YnBRxc-E9IXg,SvBNeYjCcTY,Sistemas económicos: el punto de vista de Marx
498,UCJQQVLyM6wtPleV4wFBK06g,cqnfyprfMqM,¿Por qué IRLANDA se está convirtiendo en el país MÁS RICO de EUROPA? - VisualPolitik
499,UCJQQVLyM6wtPleV4wFBK06g,SnxeJW9l4kE,PARAÍSOS FISCALES: lo que NUNCA te CUENTAN - VisualPolitik
500,UC9eCLBSj2fCYUsnMuelRloQ,9BmZJwA2Tjk,Así era la educación durante la dictadura franquista | Franco. La vida del dictador en color
501,UCGWt3Hunyq2i8Qso_de8x5g,W27DArY0hOI,"Comisión de Economía, Hacienda y Presupuesto. 01 dic 23. 19:00h Sección 17"
502,UCWzQmDWp_mjh3AOzPCZNzEQ,ApF4H5FnvE0,[FISIOCRACIA Y LIBERALISMO CLÁSICO] 👉 Las nuevas teorías económicas del XVIII
503,UCRwA1NUcUnwsly35ikGhp0A,kzvWOxoVJQM,"Nueva megacárcel de Bukele recibe a los primeros 2,000 reos | Noticias Telemundo"
504,UCRlBDnRQduDk4tmm1OtpSRg,91zOtqFfgxA,¿Cómo Prepararse Para La Próxima Caída De La Economía? - Burbujas Económicas
505,UCq4MDyTCxz8peOTx3x789Qw,7ICLIQy8Wpw,¿Por qué los millennials no van a tener casa propia?
506,UCBWF6OT9sHQU0rnMmUPdmyA,WeVIhWd_eIk,¿Cómo se formaron las Primeras CIVILIZACIONES? - Resumen | El Surgimiento de la Civilización.
507,UCJQQVLyM6wtPleV4wFBK06g,SnxeJW9l4kE,PARAÍSOS FISCALES: lo que NUNCA te CUENTAN - VisualPolitik
508,UCUIvPmpKsx-YnBRxc-E9IXg,SvBNeYjCcTY,Sistemas económicos: el punto de vista de Marx
509,UCJQQVLyM6wtPleV4wFBK06g,cqnfyprfMqM,¿Por qué IRLANDA se está convirtiendo en el país MÁS RICO de EUROPA? - VisualPolitik
510,UCQ1GpKa15ulyoQuxz7H4rng,OwIy20e7VlM,Un mundo sin billetes ni monedas - El fin del dinero en efectivo | DW Documental
511,UCT4Jg8h03dD0iN3Pb5L0PMA,f_YDFz_CFv8,Francia: Higiene personal como bien de lujo | Europa semanal
512,UCdjs8CWqpF5vENbYPVdbbZQ,TwrvI7qq-eA,✅ 11 Ideas de Negocios Rentables en Bolivia con Poco Dinero 🤑
513,UCpFPwQOxBz6czUgNOC3dedQ,bZAkHndquV8,EL RENACIMIENTO en 5 minutos
514,UCAMKTtcWpjjeKJnmWytLfZQ,rCJXrUY68zw,Dacia SANDERO: Moderno y Barato | Primera Prueba / Review en español | coches.net
515,UCI6QcXatdaEAaRTRjl3dc0w,GidR3MEYIKA,"V.Completa. Aprendizajes de vida: valores, éxito y liderazgo. Carlos Torres Vila, presidente de BBVA"
516,UCI6QcXatdaEAaRTRjl3dc0w,UHos21ESAZQ,"V. Completa. Psicología para el deporte y la vida. Joaquín Valdés, psicólogo deportivo"
517,UCwd8Byi93KbnsYmCcKLExvQ,6j0mWHy8QC4,"El engaño del G20: &quot;África se une y China no se lleva el beneficio de los BRICS&quot;, Abuy Nfubea"
518,UC2KeLWwWdZP3FEMmaW1Jp0A,5nYM2yYX4ew,Los Incas | Imperio Inca | Historia del Tahuantinsuyo
519,UCBWF6OT9sHQU0rnMmUPdmyA,2ZgnaPTiQB4,"Historia del ANTIGUO EGIPTO - Resumen | Origen, Política, Sociedad, Economía, Aportes..."
520,UCZx5TzdG3RC4CMNmxJLgfRw,cv4KaiJfREU,"Teen Titans Go! en Latino 🇲🇽🇦🇷🇨🇴🇵🇪🇻🇪 | ¡Dinero, dinero, dinero! |@DCKidsLatino"
521,UCVj02UenVNN3rAGz5t2BSGg,uc8X1Nv54uk,Inversión S&amp;P 500 | ¡Aclarando CONFUSIONES! | Economía en Simple
522,UCBdq2IZdl8bp1OOg5BNawuQ,77lCkxxAsns,LA CONQUISTA DE MÉXICO - TENOCHTITLTAN
523,UCKC77AR_zWXRTE2GOD_2Uag,mKv9dGrVQ-A,YA RECONOCEN QUE ENTRAMOS EN RECESIÓN - Vlog de Marc Vidal
524,UCIbJbceuvdjCnha9euKHH0Q,yKbJ1JIsI1U,Economía colonial
525,UCi961Xsy0xtms7ONGc9w8Cw,E_PVC0iRED8,Tres claves de la economía peruana
526,UC32TdiIsh_5X8tKr_9rKQyA,D07BfWwstH4,Edición Digital: Millones en alerta en EEUU por la primera gran tormenta invernal del año
527,UCGbofRROopWrumVob5w61OA,2-Os9WP4G4E,Caso Cerrado | ¡La casa de los sueños con cadáver incluido! 👩‍❤️‍👨🏠☠️
528,UCI6QcXatdaEAaRTRjl3dc0w,9OwXyBfKXdM,"V. Completa. &quot;En un mundo adicto a la velocidad, la lentitud es un superpoder&quot;. Carl Honoré,escritor"
529,UCI6QcXatdaEAaRTRjl3dc0w,nJMwKB5JAuU,"V. Completa. Neurociencia aplicada al día a día. David del Rosario, investigador en neurociencia"
530,UCBWF6OT9sHQU0rnMmUPdmyA,d0i_dVIy17o,Historia de México: El PORFIRIATO - Resumen | El gobierno de PORFIRIO DÍAZ
531,UCPH3Oz99Y_jrVBCQMjQZNSg,4pK_KGB4KmA,🌎La HISTORIA DE ESTADOS UNIDOS en 13 minutos🌎 | Resumen rápido
532,UCf6W-gNFClPt_XtQ6P44NTg,D4QAxarC1dA,DIRECTO| Díaz Ayuso preside los actos conmemorativos del 45º aniversario de la Constitución Española
533,UCknyABjdbf5eQdzp0FKVt5g,9Ht3shPYulM,PEDRO SANCHEZ:Más Allá de la Política.DESCUBRE LA VIDA Y TRAYECTORIA del Presidente de ESPAÑA
534,UCUdOoVWuWmgo1wByzcsyKDQ,F-NV1pjJ09g,"El panorama político, social y económico que enfrentará América Latina en 2022"
535,UCI6QcXatdaEAaRTRjl3dc0w,4ebt-yHf3mY,"Versión Completa. Conocer el cerebro para vivir mejor. Facundo Manes, neurocientífico"
536,UCv05qOuJ6Igbe-EyQibJgwQ,O1tGxRRBscI,Hernán Cortés y la Conquista de México
537,UCPH3Oz99Y_jrVBCQMjQZNSg,HXBjNLJlXPM,✅ La GUERRA DEL GOLFO en 10 minutos | La primera GUERRA televisada de la historia
538,UCY2hu_NT5NDbBU-HGxgqMuA,MInuGXCbe4U,Marruecos: la potencia enseña los dientes a España y quiere controlar el Magreb
539,UCxfC3u6sFXzbeB9OkoEc_uA,LUk73pUe9i4,Calle 13 - El Aguante
540,UCysHQr5Pnvlv4Nka5jBQDKQ,wrKqxhT4ZWY,LA INFLACIÓN DE EE UU ESTÁ MATANDO LA ECONOMÍA MUNDIAL
541,UCwd8Byi93KbnsYmCcKLExvQ,EPn7T0anlI8,"El centro de análisis económico Funcas prevé más crecimiento en España este año, pero menos en 2024"
542,UCUIvPmpKsx-YnBRxc-E9IXg,Pm5pcf18O6s,Impacto económico de la inteligencia artificial
543,UCFYdMS-M4mRdbxPuErz1CVw,BexcniH31_U,¿Por qué República Dominicana y Haití son tan distintos? | El Espectador
544,UCUIvPmpKsx-YnBRxc-E9IXg,NqUZQOkw_wg,¿Cuánto sabes de economía? #16
545,UC3M7etsNlrinTzT6kJj_XgQ,rOhnHsXL_PU,"¿Crisis económica en Costa Rica? Desempleo, inflación, tasa de interés e Impuestos."
546,UCm9vhvA4Ka7iRXbuJVWGTYQ,yKGL63kM_wQ,¿Cuál es el panorama económico para el Perú durante el 2023?
547,UCiXBrwba19Q5jVn9yLHZbqA,juVH9sgd_YE,Qué es la Economía y su objeto de estudio
548,UCv05qOuJ6Igbe-EyQibJgwQ,LRF6l0ci-D4,Las dos Guerras Mundiales
549,UCu_1BMAtWexWgDiJRTyd_ZA,qaJgxSwaGYs,INGLÉS con el MÉTODO que FUNCIONA para TODOS (Te RETO a INTENTARLO por 1 MES)
550,UCTapFcyNk2zzc7LnPUjNNQA,O6cfAZ0EM54,CARRUSEL ÚLTIMO TRAMO | COMPLICADO GRUPO PARA ESPAÑA Y PREVIA DEL BARÇA-ATLETI (02/12/2023)
551,UCu_1BMAtWexWgDiJRTyd_ZA,qaJgxSwaGYs,INGLÉS con el MÉTODO que FUNCIONA para TODOS (Te RETO a INTENTARLO por 1 MES)
552,UCBWF6OT9sHQU0rnMmUPdmyA,ZiauXPiWeBY,El Surgimiento del ISLAM - Resumen
553,UCjGfGSh_n3NCXr6jQG0UmTg,aklOTbJPD4I,💥 CRISIS en ESPAÑA: “El COLAPSO ECONÓMICO es INEVITABLE”
554,UC7QZIf0dta-XPXsp9Hv4dTw,4fPI0r_etdg,"CONGRESO: El DISCURSO de ARMENGOL, que NO ha GUSTADO a la OPOSICIÓN (ÍNTEGRO) | RTVE Noticias"
555,UCv05qOuJ6Igbe-EyQibJgwQ,_3aQ5DDAujA,Crisis de los misiles de Cuba
556,UC_lEiu6917IJz03TnntWUaQ,NpnakIBEpLg,Los 7 puntos más controvertidos del proyecto de ley antiinmigrante de Ron DeSantis en Florida
557,UCh7qQiw5D8jfQimeMXcQssQ,oGqfkYNF6kM,El pensamiento económico Keynesiano y Milton Friedman.
558,UCOiNhz5lCJiFIAZPsGZ5_9Q,p_tCPJIKyDY,Esto es lo que NECESITAS GANAR para SER RICO en ESPAÑA
559,UC9eCLBSj2fCYUsnMuelRloQ,zAzvdAU1RY0,La dictadura franquista a ojos de la comunidad internacional | España después de la Guerra
560,UCe1hlvtryjtpNL7b0C3c_iA,h2LvXbyoFks,¡Las ofertas más grandes del programa! 😱  | Shark Tank México
561,UCVbOEcs6RMxXXX3WWNtl_Fw,v2ZajeEprJg,🇧🇪Historia de BÉLGICA en 16 minutos y 13 mapas  (resumen) 🇧🇪 - El Mapa de Sebas
562,UCBWF6OT9sHQU0rnMmUPdmyA,EjszN7gO1MI,"El TOTALITARISMO - Resumen | El Tercer Reich Alemán, La Italia Fascista y La Unión Soviética"
563,UCI6QcXatdaEAaRTRjl3dc0w,pQEAY0nDZ3g,Versión Completa. Álvaro Bilbao: “Entender el cerebro de los niños para educar mejor”
564,UCBWF6OT9sHQU0rnMmUPdmyA,E8lN3zR1wm0,"La DESCOLONIZACIÓN de África y Asia - Resumen | La independencia de la India, Argelia, Egipto..."
565,UCv05qOuJ6Igbe-EyQibJgwQ,l48uSWXya-U,El Jesús histórico en 14 minutos
566,UC71VTsUKOsh6QEGnzaa2KuQ,EQ1H9uAYouM,¿Estamos en el declive económico de EEUU? #crisis #inflacion #economia #shorts #fed #inversion
567,UCtgzcsuhryfnpjXYoDyVMiA,YlegBWZ8Pq0,30 Curiosidades que no Sabías sobre Turquía | La cuna del Imperio Otomano
568,UCshVTOdmZLdLj8LTV1j_0uw,zdLQodlJmsg,Las principales cinco religiones del mundo - John Bellaimey
569,UCT4Jg8h03dD0iN3Pb5L0PMA,ZVTMXWW23ys,¿Por qué los productos alemanes tienen tanto éxito? | Hecho en Alemania
570,UCtaplouazsQkJEI7pkimrGw,REl2Wm9LJs4,El Rol del Estado En La Economía
571,UCE0edAKypUlvIpkMSv6Hd4w,Pt8_vXC9DEM,LA GUERRA FRÍA EN 26 MINUTOS | INFONIMADOS
572,UCrpMfcQNog595v5gAS-oUsQ,cy-xDqZ6n7g,Reino Unido: alerta en la economía británica
573,UCVbOEcs6RMxXXX3WWNtl_Fw,26UIaDSJMIo,🇵🇪🍽HISTORIA de la GASTRONOMÍA PERUANA en 8 minutos🇵🇪🍽 - El Mapa de Sebas
574,UCrdGjkqTZVMmAOk4YDjFV-w,JHajIR2XB34,TODOS LOS DÍAS SON NEGROS DESDE QUE SÁNCHEZ Y SU PLAGA INFECTARON ESPAÑA
575,UCJQQVLyM6wtPleV4wFBK06g,Lv9mDSbcmfk,¿Por qué HOLANDA es el LÍDER MUNDIAL de AGRICULTURA? - VisualPolitik
576,UC1IYhBFQbBWIxirTRbcfIUw,,esRadio
577,UCv05qOuJ6Igbe-EyQibJgwQ,Vbu6tH0Hc-o,La Primera Guerra Mundial
578,UCI6QcXatdaEAaRTRjl3dc0w,zl6iSEC0zeE,"Versión Completa. Cuaderno de viaje de un maestro. José Antonio Fernández Bravo, maestro"
579,UC-XYwnIX5LMaCe2bWNbNLlw,,Economía Argentina
580,UCCC55kY-GuJabDV9-hFRiTA,PxPl07c4ECo,Terraplanistas vs Científicos: ¿Podemos Confiar en la Ciencia? | Punto en común
581,UCpLie5obXFdf8T0NG-IRHsA,_ngdSg4VPIM,Ni es justicia ni es social: el sistema público de pensiones - Value School
582,UCPH3Oz99Y_jrVBCQMjQZNSg,sB6VQlJez4w,⭐ La HISTORIA del SIGLO XX en 10 minutos⭐| El resumen definitivo
583,UCN4-LjtgAoKNfKRxvRfesuw,oWZgkk4u5yo,EL ECONOMISTA SANTIAGO NIÑO BECERRA SOBRE LA ECONOMÍA ESPAÑOLA 2023 RESTAURACIÓN INFLACIÓN ESPAÑA
584,UCv05qOuJ6Igbe-EyQibJgwQ,DYTsRwa7pag,La Guerra de Vietnam
585,UCPH3Oz99Y_jrVBCQMjQZNSg,N4Ljm78end4,✅ El IMPERIO ROMANO en 10 minutos | Resumen de la historia de la ANTIGUA ROMA
586,UCuwtIT8yKNqp7lrnqpnWReg,E2hkYJynKck,Los mercados reaccionan negativamente a las noticias macro positivas. Por Yuri Rabassa
587,UCmJocBytBRMbGw6haSRXnjQ,0RzF2UEwXww,SUIZA PAGA $70.000 DOLARES POR VIVIR AQUÍ | ¿TE MUDARÍAS? - Gabriel Herrera
588,UCUhfd3iG0x1Wy9-EoY6CSWQ,-1Y9OqSJKCc,La Educación Prohibida - Película Completa HD Oficial
589,UCBWF6OT9sHQU0rnMmUPdmyA,d4M0I_VoiHs,"El ROMANTICISMO - Resumen | Características, Literatura, Pintura, Música..."
590,UCT4Jg8h03dD0iN3Pb5L0PMA,uL5AXpJCn_M,¿Crece la derecha radical por la guerra de Ucrania?
591,UCp6zvh6_oW2pXbk0gPSjzyg,_oQTv2PK_uQ,Mercados en 3 minutos: Powell adopta postura dura a pesar de las preocupaciones por el crecimiento
592,UCwd8Byi93KbnsYmCcKLExvQ,XqDWgQb7tn8,TODO ES GEOPOLÍTICA | Europa frente a Rusia: &quot;Nuestra existencia depende de Ucrania&quot;
593,UCkCYv06O4w0GOfdW2Ey8jvg,8ahXMoewc2Y,"Arcadi Espada, Juan Luis Cebrián y Álvaro Nieto comentan la situación actual de la prensa española"
594,UC4Obh9UQ2r6FyeoIEPF-bBA,STAtmg5N_tE,Cómo Hacer un Mapa Mental Fácil y Rápido 😱 | (Paso a Paso con Ejemplos)
595,UCiBkbU6jMFk1wRsgpCt_Rdw,JL8_JSYt3pc,"Sí a la PGU, NO a la Reforma | Buenos Días Mercado"
596,UCXCexi3Dc5eDLsNlxacuc6g,WH0vF07VggY,¿CUANTO GANA LA GENTE EN ESTADOS UNIDOS? - Oscar Alejandro
597,UCPH3Oz99Y_jrVBCQMjQZNSg,BF0zfeFgRZ0,💣La GUERRA DE VIETNAM en 11 minutos💣 | resumen FÁCIL y RÁPIDO
598,UCGXbLrVe8vnkiFv7q2vYv3w,Su9JITMyQMw,La Comisión Europea desmiente a Bolaños y niega haber expresado &quot;cero preocupación&quot; por la amnistía
599,UCFYqNfxE5JWNeYuZuaM4YNQ,xRb9EotKSCY,El Futuro del MUNDO RURAL - Nazaret MARTÍN y Santiago ARMESILLA [Encuentro]
600,UCSYrgT1FrF6zAkiTfFr2HcQ,er1ex9uyg94,ARGENTINOS Piden AYUDA a PERÚ para ELEGIR que MODELO ECONOMICO USAR y bajar INFLACI0N
601,UCwd8Byi93KbnsYmCcKLExvQ,7EMe3Ro1ujw,&quot;Tuvimos malas cifras de inflación en España por los precios de la electricidad&quot;. Xavier Carulla
602,UCo1g4EQqLwMO9RqEv1rCUpQ,4ZpjVtuyEMg,Breve historia política de Colombia
603,UC-0pkBeaC8lZowrcWs4P6sg,T0xBjeO24TI,Axel Kaiser vs J.C. Rodriguez y Entrevistada: &quot;Son unos Ignorantes Absolutos&quot;
604,UCwd8Byi93KbnsYmCcKLExvQ,vm3I8smPddg,"DIRECTO | Mentiras del petróleo, Rusia vuelve a los misiles de largo alcance, África se posiciona"
605,UCKadCx-t_VmwzfWczlWE98w,kyHjyEx6jxA,ECONOMÍA PLURAL (18.04.2022)
606,UC6eJ1Ne3fbAH2iNGc8Seppw,FEy1oMRGlBo,🛢️Qué es la Demanda y Oferta | ¡Explosión en el Precio del Petróleo! | Reacción a Juan Ramón Rallo
607,UCaOPVBNqmxGI83fBYqP1PBQ,Qbehv-3Eop4,Daniel Lacalle 👉 Caen los precios del Gas Natural ¿Por qué TÚ no lo vas a notar?
608,UCIvqcSPbzQBynjq230v9_yw,Eshv7H2nrvA,Retos y perspectivas económicas ante el 2023: La situación internacional ante el 2023
609,UC4oQAvXFuNlKivYjUynQKTA,,RevistaSemana
610,UCTu_1kRqnLDk9m2g5pdEoeQ,xZ3WNruN-6k,🔴 Economía boliviana con problemas según informe de Fitch
611,UC-lks6hyO-AF4YE_ZJv0hzA,Ty525XtPOAs,FANÁTICOS DE MILEI ASEGURAN QUE MÉXICO NO AYUDÓ A ARGENTINA Y SIGUEN BURLÁNDOSE DE LOS MEXICANOS
612,UCEw4oyJKvmYPoIpSa8cfr7A,voUOwshGuhY,Youtubers y Andorra: ¿Es ético no pagar impuestos en tu país? | Gen Playz
613,UCZVJvo-2S8c41zsEmySwcTA,kaSG0H1nZvM,No podras creer la inflación en Colombia #colombia #noticias #economia
614,UCGXbLrVe8vnkiFv7q2vYv3w,Su9JITMyQMw,La Comisión Europea desmiente a Bolaños y niega haber expresado &quot;cero preocupación&quot; por la amnistía
615,UCrdGjkqTZVMmAOk4YDjFV-w,pdzrVFEx0QA,El COSTE ECONÓMICO de una posible AMNISTÍA
616,UCRlBDnRQduDk4tmm1OtpSRg,r9K3vXMyyrE,Cómo Funciona La Máquina De La Economía (En 27 Minutos) - RAY DALIO //FULL ESPAÑOL
617,UC7xRHsHuEMK1P0PLHdFsErg,bzdVqbY_E6I,México es un país de oportunidades económicas
618,UCHd1jtI_QucQi0korHLdSoA,GZUf0bZMoe8,ANÁLISIS DE LA SITUACIÓN ECONÓMICA DE BOLIVIA
619,UC1wsZxnClZgLxykopBelOEA,Yuwip8z3V0A,Soluciones a la crisis del modelo económico. Caso Bolivia 2023.
620,UCCwVIDA-8wV4D_GpYNVecrg,E7QkcyEwmhs,Economía heterodoxa: No uno sino varios enfoques
621,UCzmd9Aj2wmPggWZJpLdBB8Q,RWtxMvpdxg8,Samuel García podría regresar a la gubernatura de NL... De no ser ganador | PROGRAMA COMPLETO |
622,UCyXHCFqljyxn8U50Cgoax6w,gqlDZlASf68,Yo también fui progre... y constitucionalista. FORJA 232
623,UCysHQr5Pnvlv4Nka5jBQDKQ,Fn0DmsdseRQ,CONFIRMADO: LA RECESION ES EN 2023
624,UCR9120YBAqMfntqgRTKmkjQ,V50Ma09b-Ws,"📣 Facundo Moyano, mano a mano con Esteban Trebucq"
625,UCFCK798jsVokM5oRvBi9asA,HYTg7zB5IpU,PROFESOR EXPLICA CÓMO Y POR QUÉ DEJAR LAS REDES SOCIALES🤯❌📲 | Cal Newport &amp; Lewis Howes
626,UClsjSNCR-0KAFw0v5uVMCHQ,JegXxmlPAOk,Directora de la Dipres da un balance de los dos meses de tramitación del presupuesto 2024
627,UCfZnmQp92JqFxB3CAlDsrPg,GXkjOdbhZ6o,Los Reyes y la princesa Leonor presiden la apertura de la XV Legislatura de las Cortes Generales
628,UCtl0vf1nMI55vq5g-hZHxaw,g1-GkbwVwYE,ÍNDICE MUNDIAL LIBERTAD ECONÓMICA EN LATINOAMÉRICA
629,UCwd8Byi93KbnsYmCcKLExvQ,0RvxoU-XCrg,"INFORMATIVO: Israel planea una &quot;guerra larga&quot;, Rusia avanza, Zelensky presiona y Europa amenaza"
630,UCaOPVBNqmxGI83fBYqP1PBQ,rs4UxEg0_ns,Daniel Lacalle 👉 ¿Qué esperar de los BANCOS CENTRALES? Análisis Euro y dólar
631,UCwd8Byi93KbnsYmCcKLExvQ,prnbkVnxiGQ,Análisis: El problema de la inflación empeora. Ya no es solo energía. Hay contagio a otros productos
632,UCBn78BmYPo7XtbZUANgncYw,LK2gAmBe09g,Te explico la diferencia entre recesión y una depresión económica #economía #recesión #shorts
633,UCNKomgId0-uTA-vVLM9v1pw,IQ2q1fIKgKc,"Tendencia al alza: Paco Pérez pronostica que el Ibex supera los 10,200 puntos en el horizonte"
634,UCar8wBDbTayRhNqusKFw_Fw,p73YXNsMCT8,"Análisis del mercado SEMANAL: Noticias, análisis y oportunidades de inversión"
635,UC1wsZxnClZgLxykopBelOEA,LusPMn1jN6M,Colapso modelo económico populista en Bolivia 2023. Qué hacer?
636,UC-FVhfqCwhzpJ4DTJOMMofA,EQug3MyCnz4,Latinus Diario: 29 de noviembre
637,UCfHbPOFgzLBsl-_ozg7peRQ,ZyLa0-LekRI,La ECONOMIA de PERU 2022 es Detenida por Pedro Castillo
638,UCknyABjdbf5eQdzp0FKVt5g,-OgtDjK5KtM,"LA FUERTE CRÍTICA DE ALEMANIA A PEDRO SANCHEZ: &quot;DEMASIADO EGO, NO SE TOMA LA LEY ENSERIO&quot;"
639,UCQ2Fej5pr1ipVeBWTX8Sc_Q,pR8ualVVDlc,🔴 DIRECTO | El rey Felipe VI abre la XV Legislatura en el Congreso (29/11/2023)
640,UC71sOOBgRu5UL-opaFVFstw,_HcxVGrU3qk,POR QUÉ LA ECONOMÍA ESPAÑOLA ES UN ESPEJISMO: ¿Otra crisis al final del túnel? LOS DATOS
641,UCNKomgId0-uTA-vVLM9v1pw,ds0ll6yE68I,Serguéi Shoigú revela terrorífico avance ruso | Posiciones fortificadas y 125.000 bajas en Ucrania
642,UCwd8Byi93KbnsYmCcKLExvQ,q9TI1bOqntQ,"LO MEJOR DEL DÍA | Rusia vuelve al largo alcance, el millón de municiones de Ucrania y China"
643,UCNKomgId0-uTA-vVLM9v1pw,6KM9JgjUdyY,Perspectivas 2024: Análisis profundo de los mercados financieros con expertos
644,UCSElGMkcY380tqEPD22YYRA,AwN-O0K_Oq4,#EnVivo - NOTICIERO EL SALVADOR DEL MEDIODÍA 1 DE DICIEMBRE DEL  2023
645,UCmofP1gcUiGaHR2czdlMINQ,TGU118L_4Bg,&#39;Perspectivas económicas 2024:desafíos en clave económica’
646,UCxvyhTVufyLUvUdBrAKxkWA,L-k_N8hHl4Q,"Luis Garicano, para recuperar el crecimiento en España"
647,UCOdVsRciFGCZIYiqVc_CyEA,MUx6-qMSFUE,Historia económica: los 5 sistemas económicos por los que ha atravesado la humanidad.
648,UCpkXqMFC1gm4nO8PmiAt7IQ,awL3z06J4o0,PROGRES Españoles LLORAN por MILEI
649,UCysHQr5Pnvlv4Nka5jBQDKQ,blfom1TB8Io,"FORO ECONOMICO MUNDIAL: &quot;NO SERÁS DUEÑO DE NADA, Y SERÁS FELIZ&quot;"
650,UCpkXqMFC1gm4nO8PmiAt7IQ,awL3z06J4o0,PROGRES Españoles LLORAN por MILEI
651,UCNudII4v6tI_d2mgnYqg-HQ,kTbvGRvPj7k,CUBA ECO / CUBA ANTES Y DESPUES / LIBERALISMO ECONOMICO / ECONOMIA DEL MUNDO / PASAPORTE LIBERTARIO
652,UCysHQr5Pnvlv4Nka5jBQDKQ,blfom1TB8Io,"FORO ECONOMICO MUNDIAL: &quot;NO SERÁS DUEÑO DE NADA, Y SERÁS FELIZ&quot;"
653,UCOa_xin4Vcnrl8WhoJd1n8Q,lUuzsAkE-mA,¿Qué es el monetarismo? Origen del monetarismo Características Keynesianismo versus Monetarismo
654,UCwd8Byi93KbnsYmCcKLExvQ,0poQgSzXLQI,"Claves del día: La doble crisis que amenaza, trampas al solitario de Alemania y ¿paz en Ucrania?"
655,UCorKpveMpYQxg-SqjvwgYQw,sQqY0W9mQJM,"Desarrollo Economico de América Latina - Pensar la historia, hoy!"
656,UCCibRFbyaiOjfL_eMRFLvEg,9UDPis8hAvg,Guillermo Moreno con Jorge Rial en Radio 10  30/11/23
657,UCRvpumrJs0qY1xLzeU0Ss1Q,ajInD28bllI,🔴 DIRECTO | Rueda de prensa de Ignacio Garriga
658,UClZrdRHTiNm3gTj47zGsdbQ,TwlnSffT_0Q,Elle ¿Evolución o retroceso de la lengua española? 8 pasos para dividir y conquistar. Una opinión
659,UCGKtGZSPLsSJbwc7LXDvWRw,SrGVOAH5EbI,Desarrollo económico en Marruecos
660,UCN4-LjtgAoKNfKRxvRfesuw,F23DLZ9i6ro,QUIEBRAS BANCOS EMPRESAS SEGUN BCE MOROSIDAD  INFLACION PEOR DINERO 2022 ECONOMIA ESPAÑOLA CRISIS
661,UClgj5Y7tII8GNUXYQrsGCiA,ENeuyhr1hvI,¿Pueden los RICOS MANTENER ESPAÑA?
662,UCOdVsRciFGCZIYiqVc_CyEA,Wjq_WOZcvQY,Historia económica: los cinco sistemas economicos
663,UC0OCdziicMP-0rTOp8BtP_g,0xIW3ijV8YE,🇪🇸 MADRE ESPAÑOLA REACCIONA a 10 MENTIRAS que TODOS DICEN de MÉXICO 🇲🇽🤬 *sin PALABRAS*
664,UCqcz2QApjBlANrKJE-kMmyw,PF6WzJEA2Ro,📊 QUE SON LAS VARIABLES ECONOMICAS📕
665,UCk3eFaIQTyb-i_P5qrfhLVg,Dtx-DUVZYlc,Daniel Noboa y su primer discurso | ¿Odia a Abad? | BN Periodismo | Noticias de Ecuador
666,UCHk5aDS8qlMdQMlmyHd3hbA,ugmSsUeVIRw,BANCO UNITED BTC Comentarios y críticas | Noticias económicas 18.12
667,UCb7Sa2YwGVAPP9jcsci4Bsw,VfcA3OJNSZA,🔥 BITCOIN alcanza los $40.000: ¿QUE debemos HACER? Análisis semanal ✅
668,UC1KFgMi-KVzNKnvYIkFxqCg,11d9oekmQ-w,SE DESATA LA POLÉMICA EN LA INAUGURACIÓN DE LA XV LEGISLATURA.
669,UC_htNrliIzPPsDsChTVDcwg,hhQQqmy5GQM,💥📊Noticias financieras del 1 Diciembre 2023
670,UC4UtHUVHl463GBlOcnE8-7g,26ndke9WoCg,¿Milei Conseguirá CONTROLAR la Economía de Argentina? - Economía Argentina
671,UC_0a8GkJcUFxj0bQ7Th-wPA,ymY4vyBm6xE,&quot;La mano invisible del gobierno. Los hilos que mueven la economía española&quot; (Emilio J. Gonzalez)
672,UCeGfgM5oI9RSpFIjl_AaOXg,rjSX6XOL95M,La Base 4x50 | Las Maniobras de BUKELE para AFERRARSE AL PODER en El Salvador
673,UCHk5aDS8qlMdQMlmyHd3hbA,nWIetGbsc_Y,BANCO UNITED BTC Comentarios y críticas | Noticias económicas 16.03.2020
674,UCabSHZ9Eh8A9RKWhuR1jVvA,v9o06l-SFf0,🇲🇽 ESPAÑOLA EXPLICA CUAL ES LA REALIDAD DE MÉXICO QUE NO CUENTAN LAS NOTICIAS | MUY SORPRENDENTE
675,UC0OCdziicMP-0rTOp8BtP_g,rCo57iaYLKA,🇪🇸 ESPAÑOLES REACCIONAN a LOS 10 PAÍSES con MÁS CIUDADANOS en MÉXICO 🇲🇽😱 *NO ESPERÁBAMOS ESTO*
676,UCM3_aic1cmu-Bu3qi6AcTag,L8rxs1ugftQ,⚠️ La Educación Financiera en España es una p*** mi**** #shorts #finanzas #libertadfinanciera #short
677,UCD5KkySyK7JyT_ROuWLrAig,QESCOQM0aeo,Por fin deja Coahuila Miguel Riquelme
678,UC47lxLJoVkfcaMkhD1rM-mw,NEGdUn4XHrs,Nueva modalidad de vídeos! Veremos que opina la gente en España sobre cosas de economía! #dinero
679,UCn7sBic65frsQElTrC-0YfQ,tMvL_gtN5gU,¿Cuáles son los objetivos económicos en Gaza?
680,UCTL6nhGSDQHnCCBcqAe9PNw,6GNHeUHi1vI,&quot;Los días de Netanyahu aparecen contados.&quot; - Prensa alternativa
681,UCNKomgId0-uTA-vVLM9v1pw,RURtyvvaNIw,&quot;¿Dónde Invertir en Europa? Descubre los Sectores y Valores más Prometedores&quot;
682,UCN4-LjtgAoKNfKRxvRfesuw,J9MJRnAruq4,BANCOS ESPAÑA FUSIONES QUIEBRAS EMPRESAS MOROSIDAD  PEOR DINERO 2021 ECONOMIA ESPAÑOLA CRISIS
683,UCR1tLg8fy9dklmhZPf0qCWQ,H0tx13C6ZV4,Emisión Estelar - 30 de noviembre de 2023
684,UC4UtHUVHl463GBlOcnE8-7g,QRjMTUbCi4E,Por Esto MILES de Personas MALVIVEN en las CALLES de Nueva York
685,UCbYu128-_tCzaArNr5R2DIw,Ir9vTdAnEtw,Más se Perdió en Cuba | 02/12/23
686,UCTL6nhGSDQHnCCBcqAe9PNw,st5vI-bw2rA,¡¿SOPRENDIDOS POR LA DERROTA?! Los medios alemanes finalmente despabilan respecto a Ucrania
687,UCPogq_XeepdTrQfTxH12fYg,_-n9slo-Coo,Porque es importante la economía?
688,UCY8YqoElhQuYgj59mZmhqnA,iCzNHYVMgSQ,AMP. Bolaños cree que el TS abre la puerta a que entidades privadas cuestionen al Gobierno al revoca
689,UCnL-ojoXA-6DcqLlqYVmKdA,J2ejJeE-E9w,ARIES| ESTA PERSONA JAMÁS HABÍA SENTIDO LO QUE AHORA SIENTE POR TI 🥰 LE FASCINAS 😍🔥
690,UCU3KUrTI3RJu4rrbKxS8rug,sNR-sFPkVYQ,"ECONOMÍA ABIERTA #3. Análisis de la economía española: Paro, inflación, deuda"
