,canal_ID,video_ID,video_Title
0,UC7QZIf0dta-XPXsp9Hv4dTw,T-smnnEAdM0,AMNISTÍA: La COMISIÓN EUROPEA pide al GOBIERNO más INFORMACIÓN sobre la futura LEY | RTVE
1,UCVimQoXNCZuEnZRVAbuYMiw,0HVzuoDgkkY,"Felipe González, sobre la amnistía: “Es el Estado el que pide perdón, no el que perdona”"
2,UCwtM4HFU4o6E41cKpvsHJVg,aXLB8r1t8ec,Ley de Amnistía: ¿ESPAÑA podría PERDER FONDOS de la UNIÓN EUROPEA?
3,UC7QZIf0dta-XPXsp9Hv4dTw,ESCHnb7VfnY,AMNISTÍA: El PP acusa a SÁNCHEZ de poner la CONSTITUCIÓN al servicio del INDEPENDENTISMO | RTVE
4,UCVimQoXNCZuEnZRVAbuYMiw,-xFqEigRo4w,"¿Se puede aprobar una ley de amnistía? Difícil, pero no imposible"
5,UC7QZIf0dta-XPXsp9Hv4dTw,r5FCVyuH99M,AMNISTÍA: PARTE del CGPJ pide un PLENO EXTRAORDINARIO para RECHAZAR la LEY | RTVE
6,UCyoGb3SMlTlB8CLGVH4c8Rw,9bcqPkMUO78,Bruselas analiza la ley de amnistía con &quot;objetividad&quot; e &quot;independencia&quot;
7,UC7QZIf0dta-XPXsp9Hv4dTw,nfYacdKKOUc,AMNISTÍA: ARAGONÈS y GARRIGA protagonizan un BRONCO DEBATE en el PARLAMENT | RTVE Noticias
8,UCnsvJeZO4RigQ898WdDNoBw,wE_mhtupxhI,¿Qué es la amnistía y en qué se diferencia del indulto del procés de Cataluña? | EL PAÍS
9,UC7QZIf0dta-XPXsp9Hv4dTw,bLYiYTQNxO0,LEY AMNISTÍA: El PSOE la REGISTRA en el CONGRESO SIN sus SOCIOS y la explica los DETALLES I RTVE
10,UC8FOhz3iXhF1iqqzAFfBjmA,NwqXRvcknFE,Las cuatro veces que Sánchez negó la amnistía «por convicción personal y política»
11,UC7QZIf0dta-XPXsp9Hv4dTw,gnWq3ecNZPU,AMNISTÍA: Los PROGRESISTAS del CGPJ se plantean NO ACUDIR al PLENO para RECHAZAR la LEY | RTVE
12,UCvmXCP4_uD4Imt8npcFXZ4A,Twp0b-8LR8Y,Ley de amnistía: ¿Qué es? ¿Es posible su aprobación?
13,UC7QZIf0dta-XPXsp9Hv4dTw,Extyq1E2jqA,LEY AMNISTÍA: El GOBIERNO dice que es &quot;IMPECABLE JURÍDICAMENTE&quot; y pide CONFIANZA | RTVE Noticias
14,UC7QZIf0dta-XPXsp9Hv4dTw,RyK3eOq7vO4,INVESTIDURA: SÁNCHEZ dice que “SERÁ CLARO&quot; sobre la AMNISTÍA &quot;CUANDO TOQUE&quot; y NO PREVÉ ELECCIONES
15,UCnsvJeZO4RigQ898WdDNoBw,RYvRgd0kOcU,DIRECTO | Debate en la Eurocámara por la ley de amnistía española
16,UC7QZIf0dta-XPXsp9Hv4dTw,JK_t8qgiP8I,INVESTIDURA SÁNCHEZ: ZAPATERO defiende la AMNISTÍA y dice que “NO es INCONSTITUCIONAL” | RTVE
17,UC7QZIf0dta-XPXsp9Hv4dTw,dcTvQcPX9Us,AMNISTÍA: PSOE y JUNTS alcanzan un ACUERDO sobre la LEY y la INVESTIDURA de SÁNCHEZ se allana | RTVE
18,UCoA66gIqiExUIjwyw1cB9Dw,nu7BI4OXaFc,AMNISTÍA A PUIGDEMONT: Sánchez Sin Escrúpulos
19,UCUdOoVWuWmgo1wByzcsyKDQ,imxbMHG9A4M,La polémica ley de amnistía en España que permitirá seguir al actual presidente Pedro Sánchez
20,UCnsvJeZO4RigQ898WdDNoBw,F0NsQZPC_Y8,Pedro Sánchez defiende la amnistía en el comité federal del PSOE por “el interés de España&quot; |EL PAÍS
21,UC7QZIf0dta-XPXsp9Hv4dTw,4bI8YZN2AUQ,CONCENTRACIONES AMNISTÍA: CIENTOS DE MILES DE PERSONAS &quot;POR LA IGUALDAD&quot; a petición del PP | RTVE
22,UC8FOhz3iXhF1iqqzAFfBjmA,nKffUsqKvak,Los Fiscales piden a Bruselas que si Sánchez aprueba la amnistía actúe con España como con Polonia
23,UC7QZIf0dta-XPXsp9Hv4dTw,WsSb2j2VWm8,INVESTIDURA: El PP califica de HUMILLACIÓN el ACUERDO de ERC y PSOE sobre la AMNISTÍA | RTVE
24,UC7QZIf0dta-XPXsp9Hv4dTw,WWDqNparDXg,AMNISTÍA: PSOE se DESMARCA de sus HISTÓRICOS y criticas a GUERRA por su COMENTARIO sobre DÍAZ | RTVE
25,UC4O4jH5PBsZagQ6aPWPibRQ,FBHH4ee-rco,La polémica ley de amnistía en España que permitirá seguir al actual presidente Pedro Sánchez • RFI
26,UCwd8Byi93KbnsYmCcKLExvQ,Yh6-zjK1DJE,ÚLTIMA HORA | El Gobierno de España se adelanta: irá a Europa a explicar la ley de la amnistia
27,UCT4Jg8h03dD0iN3Pb5L0PMA,ZCFBcnacZ5w,Acuerdo por ley de amnistía desata protestas en España
28,UC7QZIf0dta-XPXsp9Hv4dTw,gcunCvYGwf0,AMNISTÍA: JUNQUERAS y OTEGI piden AVANZAR en el INDEPENDENTISMO en ACTO del SINN FÉIN | RTVE
29,UC7QZIf0dta-XPXsp9Hv4dTw,C5nhMAQCw0U,AMNISTÍA: Voces CRÍTICAS del PP NO VEN &quot;ACERTADA&quot; la CONVOCATORIA tras las palabras de AZNAR | RTVE
30,UC7QZIf0dta-XPXsp9Hv4dTw,MrFyo7S0kvQ,INVESTIDURA: IBARRA compara la AMNISTÍA con una VIOLACIÓN y ALEGRÍA le pide &quot;CONTENCIÓN&quot; | RTVE
31,UCVimQoXNCZuEnZRVAbuYMiw,pdPpViopVik,Las reacciones del Gobierno ante una futura ley de amnistía: &quot;No estamos en ese momento&quot;
32,UC8FOhz3iXhF1iqqzAFfBjmA,o_UZvO-PW0M,La hemeroteca de Sánchez y su Gobierno: «Amnistía no»
33,UCdRY2RSPw1xg5g0N_hQCzWw,b_0OCx3tF68,🇪🇺 ¿Qué opina la UE sobre la amnistía en España? | Simple Política
34,UC7QZIf0dta-XPXsp9Hv4dTw,SV0LYfvuINU,MANIFESTACIONES en CONTRA de la LEY de AMNISTÍA ante la SEDE del PSOE en 10 CIUDADES ESPAÑOLA | RTVE
35,UCnsvJeZO4RigQ898WdDNoBw,f9GJlu9afSc,AMNISTÍA | El comisario europeo Reynders: &quot;Cataluña es &#39;un asunto interno&#39; español&quot; | EL PAÍS
36,UC7QZIf0dta-XPXsp9Hv4dTw,gCCjJpp7fb4,LEY AMNISTÍA: La COMISIÓN de JUSTICIA de la UE la estudiará &quot;CUIDADOSAMENTE&quot; cuando se APRUEBE |
37,UC8FOhz3iXhF1iqqzAFfBjmA,Y0B4FOuRJAs,"El Debate, a pie de calle: «La amnistía no la necesitan los españoles, la necesita Sánchez»"
38,UCnsvJeZO4RigQ898WdDNoBw,WGBjfoHVbhs,FERRAZ | Dentro de la manifestación más numerosa contra la amnistía y la investidura de Sánchez
39,UC7QZIf0dta-XPXsp9Hv4dTw,IAMEoUaVBE8,SÁNCHEZ habla de AMNISTÍA: &quot;Una FORMA de SUPERAR las CONSECUENCIAS JUDICIALES de la CRISIS&quot; | RTVE
40,UC7QZIf0dta-XPXsp9Hv4dTw,uy-ZAWxRbZA,UE: El PP EUROPEO llevará la AMNISTÍA al próximo PLENO del PARLAMENTO EUROPEO | RTVE Noticias
41,UC-9V-k1ugOGSePgIw3UevTQ,2G5JwsdheIU,"Alfonso Guerra, sobre la amnistía: &quot;Me rebelo, no lo aguanto, no lo voy a soportar&quot;"
42,UC7QZIf0dta-XPXsp9Hv4dTw,G0QMdnjrkqo,CGPJ: APRUEBA una DECLARACIÓN contra la LEY de AMNISTÍA gracias a la MAYORÍA CONSERVADORA | RTVE
43,UC7QZIf0dta-XPXsp9Hv4dTw,9DRRpS2FAmw,AMNISTÍA: BOLAÑOS emplaza a BRUSELAS a abordar la LEY cuando se REGISTRE en el CONGRESO | RTVE
44,UC7QZIf0dta-XPXsp9Hv4dTw,FgSSEV2p9Ek,El PP MUEVE FICHA contra la AMNISTÍA en vísperas de la INVESTIDURA de FEIJÓO | RTVE Noticias
45,UC8FOhz3iXhF1iqqzAFfBjmA,wN5wXnFoV1g,Así ha evolucionado el discurso de Pedro Sánchez sobre la amnistía
46,UCUS73_bjTYwBFAfXbvIjM8Q,imi6edqUeCE,Europa pide explicaciones al Gobierno por la amnistía
47,UCnsvJeZO4RigQ898WdDNoBw,48I6sIPrAkw,INVESTIDURA | Bolaños explica la ley de amnistía del PSOE: &quot;Queremos cerrar heridas&quot; | EL PAÍS
48,UC7QZIf0dta-XPXsp9Hv4dTw,n2kI6Vx8FKg,PROTESTAS AMNISTÍA: ¿QUIÉNES son los ULTRAS que han provocado DISTURBIOS en la sede del PSOE? | RTVE
49,UCnsvJeZO4RigQ898WdDNoBw,fBB7uQQa76Y,"FERRAZ | Manifestantes protestan contra la amnistía ante la investidura: &quot;Puigdemont, a prisión&quot;"
50,UCwd8Byi93KbnsYmCcKLExvQ,NcxcrZZOvws,Europa se tapa los ojos ante la crisis política en España: ¿amnistía a &quot;delitos de terrorismo”?
51,UC8FOhz3iXhF1iqqzAFfBjmA,c0e7v33JBT8,"DIRECTO | &#39;La amnistía, a debate&#39;, con expertos juristas y moderado por María Jamardo"
52,UCvJS-YNyaWyOucx8bGrHVvw,drvcyoCCc54,Sánchez defiende la amnistía para &quot;tener un gobierno&quot; y &quot;avanzar en la concordia&quot;
53,UClLLRs_mFTsNT5U-DqTYAGg,Wd_pmlvFqs8,"Borrell, sobre la ley de amnistía: &quot;Ya se pueden imaginar lo que pienso&quot;"
54,UCUS73_bjTYwBFAfXbvIjM8Q,Oro9f03tVuI,¿Puede el Senado o los jueces parar la amnistía de Sánchez y Puigdemont?
55,UCVimQoXNCZuEnZRVAbuYMiw,OoFL4l62-oM,El PSOE y Sumar enfrían la ley de amnistía antes de la investidura de Sánchez
56,UC8FOhz3iXhF1iqqzAFfBjmA,m4XvEa8FeUg,España desarma la amnistía de Sánchez: «Ha quebrado la Constitución»
57,UC7QZIf0dta-XPXsp9Hv4dTw,iuIC1L3WaLg,INVESTIDURA: El PP anuncia NUEVAS MOVILIZACIONES para protestar contra la AMNISTÍA | RTVE
58,UCnsvJeZO4RigQ898WdDNoBw,aVNeLx7ImRA,AMNISTÍA | La &quot;humillación&quot; del mediador y otros titulares de la manifestación del PP | EL PAÍS
59,UCwd8Byi93KbnsYmCcKLExvQ,fuYNl1ylTiE,El Rey de España ante la amnistía: su poder para evitar la desaparición del Estado de Derecho
60,UCGXbLrVe8vnkiFv7q2vYv3w,1tcOXjx3mBA,Page rechaza la amnistía y avisa que aunque cupiera en la Constitución &quot;no casa con valores de PSOE&quot;
61,UCPd-Lf5gQkAJD5XdTmT_GGA,eZ_D0WtcfMI,"Alsina, sobre la ley de amnistía: &quot;Ahora el conflicto es entre españoles&quot;"
62,UCVimQoXNCZuEnZRVAbuYMiw,UHl1Yp8YtG8,"Sánchez: &quot;Ni el referéndum ni la amnistía son posibles, pero espero llegar a una posición pactada&quot;"
63,UCf6W-gNFClPt_XtQ6P44NTg,d5uxH79pkgQ,El enésimo &quot;cambio de opinión&quot; de Sánchez: cuando decía que &quot;la amnistía no es posible&quot;
64,UCXISYK3xagaK5DHnhQ4X0hw,pptTnnEHctU,La BROMA de BIDEN a FELIPE VI que dejó al REY a carcajada limpia | Diario AS
65,UCwd8Byi93KbnsYmCcKLExvQ,jWe76O26_xM,ÚLTIMA HORA | España: Mas tensión por la amnistía: La Guardia Civil dispuesta a “derramar la sangre”
66,UC7QZIf0dta-XPXsp9Hv4dTw,Ody3utIsdZ0,AMNISTÍA: La POLICÍA justifica en la &quot;PRESENCIA de ULTRAS&quot; su POLÉMICA CARGA en FERRAZ  | RTVE
67,UCwd8Byi93KbnsYmCcKLExvQ,ZRCFn2qlrXE,&quot;El último que puede echar atrás la ley de amnistía es el Tribunal Constitucional&quot;. Leopoldo Abad
68,UCUdOoVWuWmgo1wByzcsyKDQ,zP-05v68iZg,España: intensas manifestaciones tras firma de acuerdo de amnistía entre PSOE y Junts per Catalunya
69,UCba3hpU7EFBSk817y9qZkiA,KlCsb5ZW9hA,Investidura de Pedro Sánchez; protestas contra la ley de amnistía en Madrid
70,UCnsvJeZO4RigQ898WdDNoBw,SMaV_9JUKwM,La reacción de Pedro Sánchez cuando un vecino le grita ‘¡que te vote Txapote!’ el 28M
71,UCrdGjkqTZVMmAOk4YDjFV-w,_W7uaOqqLDk,El oscuro vaticinio de Felipe González sobre la amnistía: &quot;Puigdemont lo podrá volver a hacer&quot;
72,UC7QZIf0dta-XPXsp9Hv4dTw,2ZubVemhF7c,VOX-AMNISTÍA: ABASCAL anuncia ACCIONES LEGALES contra INTERIOR por las CARGAS POLICIALES en FERRAZ |
73,UC7QZIf0dta-XPXsp9Hv4dTw,bDtPJVGUAF0,LEY AMNISTÍA: El PSOE decidió presentarla SIN SUS SOCIOS ante las PEGAS de algún PARTIDO | RTVE
74,UCGXbLrVe8vnkiFv7q2vYv3w,6T7vXd3hd-0,Miles de personas protestan contra la amnistía frente a las sedes del PSOE en toda España
75,UCwd8Byi93KbnsYmCcKLExvQ,28xZ33-yK-s,ÚLTIMA HORA | Más tensión en España por la amnistía: represalia del Gobierno contra la Guardia Civil
76,UCvmXCP4_uD4Imt8npcFXZ4A,4QwDanfeNj4,Vox se querellará mañana contra Sánchez por la ley de amnistía
77,UCvvWGe6qnO-7LxnH3sPKMIg,6z7CjkCcNQM,JORNADAS VOX AMNISTÍA | ‘No vamos a permitir que se destruya la nación española’
78,UC7QZIf0dta-XPXsp9Hv4dTw,TDz-SLk4TyM,"LEY AMNISTÍA: Abarca MÁS de una DÉCADA de &#39;PROCÉS&#39;, incluye a los POLICÍAS del 1-O | RTVE Noticias"
79,UCvmXCP4_uD4Imt8npcFXZ4A,tTTQgI1SwXk,El comisario de Justicia de la UE avisa de que &quot;hay algunos límites&quot; a una ley de amnistía
80,UCknyABjdbf5eQdzp0FKVt5g,jJ4H7j20QGM,¿QUÉ OPINA LA UNIÓN EUROPEA SOBRE LA AMNISTÍA? ¿SALVARÁ A ESPAÑA?
81,UC7QZIf0dta-XPXsp9Hv4dTw,URZX7bN3n3A,INVESTIDURA FEIJÓO: ERC y JUNTS piden ir más allá de la AMNISTÍA y PACTAR un nuevo REFERÉNDUM | RTVE
82,UC8FOhz3iXhF1iqqzAFfBjmA,t9VcN-Ivhsk,Page critica la amnistía ante Sánchez y le afea que choca con el «proyecto del PSOE»
83,UC7QZIf0dta-XPXsp9Hv4dTw,-M8LUpbnFP8,LEY AMNISTÍA: La BRONCA se traslada al PARLAMENTO EUROPEO | RTVE Noticias
84,UC-9V-k1ugOGSePgIw3UevTQ,hh2u3WRtUx4,Expósito: &quot;Es un escándalo que Pedro Sánchez y Puigdemont estén negociando el poder y la amnistía&quot;
85,UCnsvJeZO4RigQ898WdDNoBw,qvVutu7-u74,DIRECTO | Feijóo habla sobre la amnistía en el Congreso de los Diputados
86,UC8FOhz3iXhF1iqqzAFfBjmA,GnUpOpBUmBU,"La calle, ante la amnistía de Puigdemont: «Es una barbaridad, tiene que estar en la cárcel»"
87,UCig8aKQHLt8E35_LJKwOscA,nYJtzaGf9vk,🎙 PODCAST | España - Catalunya: del abismo a la amnistía
88,UCnsvJeZO4RigQ898WdDNoBw,U4HHH2YpU8E,CATALUÑA | Aragonès: &quot;La amnistía es imprescindible&quot; | EL PAÍS
89,UCnsvJeZO4RigQ898WdDNoBw,O6hLxuaWbjs,MANIFESTACIÓN | Miles de personas protestan contra la amnistía en Cibeles | EL PAÍS
90,UC7QZIf0dta-XPXsp9Hv4dTw,Fd-LeXuUT2g,MANIFESTACIÓN BARCELONA: FEIJÓO acusa a SÁNCHEZ de hacer &quot;NEGOCIO&quot; con la AMNISTÍA | RTVE Noticias
91,UCrdGjkqTZVMmAOk4YDjFV-w,npc4ZPk_fqE,Carlos Alsina avisa de la nueva ‘trola’ que nos colará Sánchez para tragar con la amnistía
92,UClLLRs_mFTsNT5U-DqTYAGg,hqSiwWPLaU4,Aguirre se manifiesta en contra de la amnistía y reclama al PSOE un referéndum
93,UC7QZIf0dta-XPXsp9Hv4dTw,wD9iXJZg8oA,PROTESTAS AMNISTÍA: 24 DETENIDOS y 7 POLICÍAS HERIDOS tras el CIERRE del ACUERDO PSOE-JUNTS | RTVE
94,UCi4JOMSiIJxdNyUbYKS1vJQ,w507EWnIWYE,"Conferencia &#39;Desmontando las mentiras de la #amnistía&#39;, con Teresa Freixes"
95,UCvJS-YNyaWyOucx8bGrHVvw,JbKFJ1vof6Y,El gobierno y la oposición chocan en la Eurocámara en el debate sobre la ley de amnistía
96,UCnsvJeZO4RigQ898WdDNoBw,KBNAm2uIMhw,"El nacionalismo catalán, explicado en 4 minutos | España"
97,UCUdOoVWuWmgo1wByzcsyKDQ,22XyDnJUFpA,Informe desde Madrid: protestas contra la amnistía a independentistas catalanes
98,UC-9V-k1ugOGSePgIw3UevTQ,gN3uyFXTeEg,Tomás Gómez: &quot;Sánchez sacará adelante la ley de amnistía y luego el referéndum de autodeterminación&quot;
99,UC7E9Dj_lmrJdDrH2Bg7rNqQ,FzmG-zCQjIU,Protestas en España | ¿En qué consiste la polémica ley de amnistía pactada por Pedro Sánchez?
100,UC7QZIf0dta-XPXsp9Hv4dTw,wR90trJNC2E,"SÁNCHEZ-AMNISTÍA: &quot;Estamos NEGOCIANDO, cuando tengamos una posición concreta la expondremos&quot; | RTVE"
101,UC7QZIf0dta-XPXsp9Hv4dTw,84hHzfPnR2A,INVESTIDURA: SÁNCHEZ se reunirá con todos los PARTIDOS menos con VOX y evita decir &quot;AMNISTÍA&quot; | RTVE
102,UCnsvJeZO4RigQ898WdDNoBw,CmHYY1RKLms,AMNISTÍA | Rodríguez Ibarra compara la amnistía con una violación y Alegría le responde | EL PAÍS
103,UC7QZIf0dta-XPXsp9Hv4dTw,swmYdt-lhhw,"LEY AMNISTÍA: El PSOE tras REGISTRARLA SIN la FIRMA de sus SOCIOS, &quot;ES PLENAMENTE CONSTITUCIONAL&quot;"
104,UC7QZIf0dta-XPXsp9Hv4dTw,OIeGX_IsWYU,LEY AMNISTÍA: La COMISIÓN EUROPEA estudiará el TEXTO y se reunirá PRÓXIMAMENTE con el GOBIERNO |RTVE
105,UC7QZIf0dta-XPXsp9Hv4dTw,6JOefbLtGMw,AÑO JUDICIAL: El presidente del SUPREMO pide a PP y PSOE sacar sus INTERESES de la JUSTICIA |
106,UCig8aKQHLt8E35_LJKwOscA,ivCMsFM3X2Q,Felipe González y Alfonso Guerra contra la amnistía: los dardos de los veteranos contra el Gobierno
107,UC8FOhz3iXhF1iqqzAFfBjmA,g3iw67808v8,"«Sánchez, vete ya», la protesta contra la amnistía desborda Colón"
108,UC7QZIf0dta-XPXsp9Hv4dTw,UGNNMqq2RJ8,INVESTIDURA: FEIJÓO acusa a SÁNCHEZ de &quot;ATRACAR a la DEMOCRACIA española&quot; con la AMNISTÍA | RTVE
109,UCnsvJeZO4RigQ898WdDNoBw,jtCiqX-kFfc,INVESTIDURA | Manifestaciones contra la amnistía y la investidura de Sánchez en el Congreso |EL PAÍS
110,UCwd8Byi93KbnsYmCcKLExvQ,hqQvlnj48hI,España sale a la calle: indignación ante la ley de amnistía que prepara Sánchez con Puigdemont
111,UCvJS-YNyaWyOucx8bGrHVvw,PpppGELTkZY,Tres detenidos en la protesta contra la amnistía ante la sede del PSOE de Madrid
112,UC-9V-k1ugOGSePgIw3UevTQ,2G5JwsdheIU,"Alfonso Guerra, sobre la amnistía: &quot;Me rebelo, no lo aguanto, no lo voy a soportar&quot;"
113,UC7QZIf0dta-XPXsp9Hv4dTw,mdgIfFYRhuY,INVESTIDURA: SÁNCHEZ DEFIENDE la AMNISTÍA ante el COMITÉ FEDERAL del PSOE | RTVE Noticias
114,UCBKBDf4G9Ha4nrutKb02fJA,J_dXJRtTXjw,LEY AMNISTÍA. CONOCE SUS CONSECUENCIAS #amnistia #ley #noticia #derecho #viral #curiosidades #españa
115,UCGXbLrVe8vnkiFv7q2vYv3w,zOh0LCFDEAM,Manifestantes contra la amnistía interrumpen el minuto de silencio por Marruecos en Barcelona
116,UCnsvJeZO4RigQ898WdDNoBw,IVtWMEh4ztM,SERRAT interrumpe un concierto cuando le piden que cante el CATALÁN
117,UCdRY2RSPw1xg5g0N_hQCzWw,gnpcTeHy3CU,📈 ¿Qué opinan los españoles sobre la AMNISTÍA? | Simple Política
118,UC7QZIf0dta-XPXsp9Hv4dTw,TDz-SLk4TyM,"LEY AMNISTÍA: Abarca MÁS de una DÉCADA de &#39;PROCÉS&#39;, incluye a los POLICÍAS del 1-O | RTVE Noticias"
119,UCnsvJeZO4RigQ898WdDNoBw,jAiDNiW2j7U,Pedro Sánchez defiende la amnistía en el comité federal del PSOE por “el interés de España&quot; #shorts
120,UC7QZIf0dta-XPXsp9Hv4dTw,uhnETZsazFc,AMNISTÍA: TRES detenidos en las PROTESTAS ante la SEDE del PSOE en MADRID | RTVE Noticias
121,UC84t25xqhPEPpGY7NBZJ_eA,afdPWNIF6Ks,Mensaje de Miguel Ángel Revilla a Pedro Sánchez por la amnistía: &quot;Piénsatelo bien&quot; - El Hormiguero
122,UCEomZLuz_697Z_-KAVTqjPQ,-Ew2tHWkDE4,Opinión de Julián Galán sobre la Ley de Amnistía: &quot;Tiene difícil encaje constitucional&quot;.
123,UCdRY2RSPw1xg5g0N_hQCzWw,t1U83D5JqmM,¿Se puede APROBAR una AMNISTÍA en ESPAÑA? | Simple Política
124,UClLLRs_mFTsNT5U-DqTYAGg,G1rNGXiSDJY,Sánchez anuncia su apoyo a la amnistía &quot;en el nombre de España&quot;
125,UCyoGb3SMlTlB8CLGVH4c8Rw,mxaxWeudVUM,Manifestación en Madrid contra la amnistía a los líderes del &#39;procés&#39;
126,UCTJXx9onKH6g4cWHS9pLqsQ,XslSGSQEnW4,"La manifestación de Barcelona contra la amnistía en 1 minuto, por Alán Barroso"
127,UCrdGjkqTZVMmAOk4YDjFV-w,zhwoFFdDCNA,García-Page se subleva por fin contra Sánchez y la miserable amnistía: &quot;¡Vamos a plantear batalla!&quot;
128,UCUS73_bjTYwBFAfXbvIjM8Q,e8ek7_9PTco,Cantabria denuncia en Bruselas la ley de amnistía
129,UC8FOhz3iXhF1iqqzAFfBjmA,IXhwJA6T2PU,"Una magistrada, sobre la amnistía cree que aunque la Constitución no la mencione «no prejuzga»"
130,UCVimQoXNCZuEnZRVAbuYMiw,lwKL5kbxeNk,"Pedro Sánchez: &quot;En el nombre de España, del interés de España, defiendo la amnistía en Catalunya&quot;"
131,UC7QZIf0dta-XPXsp9Hv4dTw,EQZlO2PMdPU,LEY AMNISTÍA: SUMAR se QUERELLA contra los VOCALES CONSERVADORES del CGPJ y el PSOE se DESMARCA |
132,UCOxQk41rWFLWLPAPP_as6uA,osbc4B6ZIb8,Zapatero: &quot;La ley de amnistía no tiene reproches. Es valiente e inteligente&quot;
133,UCGXbLrVe8vnkiFv7q2vYv3w,6T7vXd3hd-0,Miles de personas protestan contra la amnistía frente a las sedes del PSOE en toda España
134,UCUBIrDsIVzRpKsClMlSlTpQ,xMwcXzSsmsA,Independencia de Cataluña: dos chicas discuten sus visiones a favor y en contra
135,UCig8aKQHLt8E35_LJKwOscA,9OyIDTbCtrU,Manifestantes contra la amnistía CORTAN GRAN VÍA y se concentran frente al CONGRESO
136,UCnsvJeZO4RigQ898WdDNoBw,Y6O33D27ios,"Feijóo: &quot;Si Puigdemont nos propone la amnistía como requisito, nos podemos ahorrar la reunión&quot;"
137,UCGXbLrVe8vnkiFv7q2vYv3w,T9cc7pzFzN4,El socialista Ibarra compara la amnistía con violar a 40 millones de españoles #Ibarra #Amnistía
138,UC7QZIf0dta-XPXsp9Hv4dTw,z2AEEDDEfi0,PUIGDEMONT: Marca las CONDICIONES para empezar a NEGOCIAR la INVESTIDURA | RTVE Noticias
139,UCvJS-YNyaWyOucx8bGrHVvw,d214O4un-pk,El Senado aprueba reformar el Reglamento para retrasar la ley de amnistía
140,UCnsvJeZO4RigQ898WdDNoBw,SMaV_9JUKwM,La reacción de Pedro Sánchez cuando un vecino le grita ‘¡que te vote Txapote!’ el 28M
141,UC7QZIf0dta-XPXsp9Hv4dTw,SNnBtQxWO60,SENADO: APROBADA la REFORMA del REGLAMENTO que DILATARÁ la LEY de AMNISTÍA | RTVE
142,UCUdOoVWuWmgo1wByzcsyKDQ,nW7Lo8teGao,Informe desde Madrid: manifestación masiva contra ley de amnistía a independentistas
143,UCUdOoVWuWmgo1wByzcsyKDQ,ZNen4lPbsE8,Informe desde Madrid: seguidores del PP protestan contra posible amnistía a independentistas
144,UC8FOhz3iXhF1iqqzAFfBjmA,MQcimSgQ65o,Almeida clama contra la amnistía y critica la «deshonra y el deshonor» de Pedro Sánchez
145,UCPd-Lf5gQkAJD5XdTmT_GGA,68UjKHKTXP4,Alsina comenta con Susanna Griso la ley de amnistía: &quot;Hay 13 gobiernos autonómicos en contra&quot;
146,UCvJS-YNyaWyOucx8bGrHVvw,E9x2uG0tFIY,Unos cincuenta españoles se concentran en Bruselas contra la ley de amnistía
147,UC7QZIf0dta-XPXsp9Hv4dTw,f6TDKV-n5vk,"ARAGONÈS, tras el pacto ERC-PSOE sobre la AMNISTÍA: &quot;Es hora de AVANZAR hacia el REFERÉNDUM&quot; | RTVE"
148,UCXISYK3xagaK5DHnhQ4X0hw,pptTnnEHctU,La BROMA de BIDEN a FELIPE VI que dejó al REY a carcajada limpia | Diario AS
149,UCUS73_bjTYwBFAfXbvIjM8Q,0CkEIRpyHlI,Miles de personas salen a la calle en contra de la amnistía en Barcelona
150,UCOxQk41rWFLWLPAPP_as6uA,osbc4B6ZIb8,Zapatero: &quot;La ley de amnistía no tiene reproches. Es valiente e inteligente&quot;
151,UC7QZIf0dta-XPXsp9Hv4dTw,EQZlO2PMdPU,LEY AMNISTÍA: SUMAR se QUERELLA contra los VOCALES CONSERVADORES del CGPJ y el PSOE se DESMARCA |
152,UCUBIrDsIVzRpKsClMlSlTpQ,xMwcXzSsmsA,Independencia de Cataluña: dos chicas discuten sus visiones a favor y en contra
153,UCig8aKQHLt8E35_LJKwOscA,9OyIDTbCtrU,Manifestantes contra la amnistía CORTAN GRAN VÍA y se concentran frente al CONGRESO
154,UC7QZIf0dta-XPXsp9Hv4dTw,-m_ZYkul6cU,LEY AMNISTÍA: FEIJÓO se reúne con CORRESPONSALES EXTRANJEROS para expresar su &quot;PREOCUPACIÓN&quot; | RTVE
155,UCnsvJeZO4RigQ898WdDNoBw,Y6O33D27ios,"Feijóo: &quot;Si Puigdemont nos propone la amnistía como requisito, nos podemos ahorrar la reunión&quot;"
156,UCGXbLrVe8vnkiFv7q2vYv3w,T9cc7pzFzN4,El socialista Ibarra compara la amnistía con violar a 40 millones de españoles #Ibarra #Amnistía
157,UC7QZIf0dta-XPXsp9Hv4dTw,z2AEEDDEfi0,PUIGDEMONT: Marca las CONDICIONES para empezar a NEGOCIAR la INVESTIDURA | RTVE Noticias
158,UCvJS-YNyaWyOucx8bGrHVvw,d214O4un-pk,El Senado aprueba reformar el Reglamento para retrasar la ley de amnistía
159,UC7QZIf0dta-XPXsp9Hv4dTw,SNnBtQxWO60,SENADO: APROBADA la REFORMA del REGLAMENTO que DILATARÁ la LEY de AMNISTÍA | RTVE
160,UCUdOoVWuWmgo1wByzcsyKDQ,nW7Lo8teGao,Informe desde Madrid: manifestación masiva contra ley de amnistía a independentistas
161,UCUdOoVWuWmgo1wByzcsyKDQ,ZNen4lPbsE8,Informe desde Madrid: seguidores del PP protestan contra posible amnistía a independentistas
162,UCPd-Lf5gQkAJD5XdTmT_GGA,68UjKHKTXP4,Alsina comenta con Susanna Griso la ley de amnistía: &quot;Hay 13 gobiernos autonómicos en contra&quot;
163,UC8FOhz3iXhF1iqqzAFfBjmA,MQcimSgQ65o,Almeida clama contra la amnistía y critica la «deshonra y el deshonor» de Pedro Sánchez
164,UCvJS-YNyaWyOucx8bGrHVvw,E9x2uG0tFIY,Unos cincuenta españoles se concentran en Bruselas contra la ley de amnistía
165,UC7QZIf0dta-XPXsp9Hv4dTw,f6TDKV-n5vk,"ARAGONÈS, tras el pacto ERC-PSOE sobre la AMNISTÍA: &quot;Es hora de AVANZAR hacia el REFERÉNDUM&quot; | RTVE"
166,UCUS73_bjTYwBFAfXbvIjM8Q,0CkEIRpyHlI,Miles de personas salen a la calle en contra de la amnistía en Barcelona
167,UCUdOoVWuWmgo1wByzcsyKDQ,x9mUuHMNyvY,Catalanes reaccionan al discurso del rey de España
168,UC7QZIf0dta-XPXsp9Hv4dTw,n3fjSgr4_-g,INVESTIDURA: FEIJÓO ofrece a SÁNCHEZ &quot;una TERCERA VÍA&quot; a la AMNISTÍA con &quot;PACTOS de ESTADO&quot; | RTVE
169,UCIvqcSPbzQBynjq230v9_yw,56_2_TYZz7Y,"Sánchez: &quot;Defiendo la amnistía para hacer de la necesidad, virtud&quot;"
170,UCIvqcSPbzQBynjq230v9_yw,50VmVvWC-rY,"Eneko Andueza, candidato socialista a lehendakari, se posiciona a favor de la amnistía en Cataluña"
171,UCLNZvDlwQJMaQg477NAxvjQ,FcyU_tfq9XA,"Pérez-Reverte: &quot;Estoy en contra de la amnistía, me parece mal&quot; - El Hormiguero"
172,UCrpMfcQNog595v5gAS-oUsQ,64YzlWu5L0Q,Crisis en España por la Ley de Amnistía
173,UC8FOhz3iXhF1iqqzAFfBjmA,aEFhUH6Ijcw,"Girauta, sobre la amnistía: «Toda España es víctima de un golpe de Estado»"
174,UCUS73_bjTYwBFAfXbvIjM8Q,Hb_z08exkKE,Alfonso Guerra carga contra Puigdemont y contra la amnistía
175,UC7QZIf0dta-XPXsp9Hv4dTw,dWy38wITNcg,AMNISTÍA: El CERCLE D&#39;ECONOMIA la CONSIDERA &quot;UNA OPORTUNIDAD&quot; para REFORZAR la DEMOCRACIA | RTVE
176,UC7QZIf0dta-XPXsp9Hv4dTw,AlJgDsonBO0,JUNQUERAS: Afirma que la LEY de AMNISTÍA &quot;ya está PACTADA&quot; con el PSOE desde AGOSTO | RTVE Noticias
177,UCGXbLrVe8vnkiFv7q2vYv3w,8t_bF4wcdIA,🔴 DIRECTO | El Parlamento Europeo trata la cuestión de la amnistía
178,UC8FOhz3iXhF1iqqzAFfBjmA,KeQNjk-MqIM,"Feijóo, tajante con las mentiras de Sánchez sobre la amnistía: «Su palabra no vale nada»"
179,UC8FOhz3iXhF1iqqzAFfBjmA,As8EC720uD4,Rajoy clama contra la amnistía: «Me pone muy nervioso»
180,UCI3EXOyQ5_imsQJs5pq28XQ,Erha5lJaNlE,Sánchez opta a la investidura y avisa sobre la ley de amnistía: &quot;El diálogo es el método y la Consti
181,UC8FOhz3iXhF1iqqzAFfBjmA,u80mWsaIZAE,"Leguina: «La amnistía es una bajada de pantalones impresentable, y todo por volver a la Moncloa»"
182,UCwd8Byi93KbnsYmCcKLExvQ,ZOGvO3f9A7M,DIRECTO | ESPECIAL: España en jaque. PSOE y Junts pactan la amnistía y avanza el acuerdo de gobierno
183,UC7QZIf0dta-XPXsp9Hv4dTw,f9FQdA3UnJw,"AMNISTÍA : PROTESTA  en &quot;DEFENSA DE LA CONSTITUCIÓN, por la UNIDAD y la IGUALDAD&quot; |RTVE"
184,UC7QZIf0dta-XPXsp9Hv4dTw,i65M1vgaRkA,FEIJÓO tilda de &quot;CACICADA&quot; e &quot;INDIGNIDAD&quot; la posible AMNISTÍA en un ACTO MULTITUDINARIO del PP |
185,UCQ2Fej5pr1ipVeBWTX8Sc_Q,8__QYUtrQjw,Rufián se abre la chaqueta para responder a Abascal y le deja este recado
186,UC7QZIf0dta-XPXsp9Hv4dTw,qIc8x6QlbrI,AMNISTÍA: La POLICÍA CARGA contra los RADICALES en la PROTESTA cerca de FERRAZ (MADRID) | RTVE
187,UC7QZIf0dta-XPXsp9Hv4dTw,8YWSPZIJv08,INVESTIDURA SÁNCHEZ: JUNTS NO confirma su SÍ al acuerdo ERC y PSOE sobre la AMNISTÍA | RTVE
188,UCknyABjdbf5eQdzp0FKVt5g,j_x7kLZs2bs,EL PP CONSIGUE FRENAR LA LEY DE LA AMNISTÍA EN EL SENADO- PEDRO SANCHEZ TIEMBLA
189,UCig8aKQHLt8E35_LJKwOscA,dkYGBEqr2YE,🎙 PODCAST | Amnistía: claves básicas para el debate que viene
190,UCh_chnQ7OJPQ8mZ7vbXFpIQ,yN0aXc4cH9s,Felipe González alerta del &quot;chantaje&quot; de la amnistía que no es constitucional
191,UCnsvJeZO4RigQ898WdDNoBw,G53btd11z8w,ITALIA: ¿En qué se nota que gobierna la ultraderecha de Meloni? | EL PAÍS
192,UCUS73_bjTYwBFAfXbvIjM8Q,XlCRftggDrI,El plan secreto de Sánchez y Pumpido para colar la amnistía
193,UCBYyJBCtCvgqA4NwtoPMwpQ,qm2cuOmEvOw,"AMNISTÍA A LOS INDEPENDENTISTAS, ¿DEBE HACERSE? - El periodista David Jiménez responde a Jordi Wild"
