,canal_ID,video_ID,video_Title
691,UCfYk6FdS8bFLrOz_n0b0YTQ,4lvoyvKSym0,"Despegamos: Alerta bancaria española, subida pensiones, pinza China-Saudí y despidos en Alemania"
692,UCUsPQF0ceRaQRHrtXWMmo3w,EipR-8Prb30,Milei Conseguirá CONTROLAR a Economia da Argentina? - Economia Argentina
693,UCv05qOuJ6Igbe-EyQibJgwQ,1H877pw4CCc,¿Habrá Tercera Guerra Mundial? ☢️
694,UCQtfWofZhrQhTPgMJEVoptA,ZVaHrTBvkV8,Nadia Calviño Dispara Ignacio Sánchez
695,UCsT4NSardFSUa0bokXXI6Fg,w8CrUdyuoNE,La invasión a Palestina le saldrá muy cara a Israel - Entrevista con Ezequiel Bistoletti
696,UCGQNq48_VaF2w07lJth-yNA,xEtEuJ4yUa0,Quiebra española inevitable I Demos economía con Roberto Centeno
697,UCjUl52TXxMbfjRry5KrdMUA,xYJkEAoUOJ0,Cierre semanal ✅ Dólar🇺🇸🇨🇱 consolida bajo los $865 🔻 y FED anuncia pausa en las tasas❌
698,UCKpYqSlccJQyPke4XrnZlSA,8DgQlZtFpBg,"Dólar, inflación y deuda la economía que se viene; el análisis de Claudio Loser, economista"
699,UCWskhODEDHkR2jYixg6Febw,QYpjTUnJGzY,Aclaración sobre Pago de Salario y Vacaciones para Emigrantes en España
700,UCRte5IhQVwgD5Dh-kL9SOLg,MpblqlEh6nY,Hacia la Renta Básica Universal
701,UCpG0HepbRoEyhvlF0jUIujg,hDm47dPY5_g,REGRESA IBERDROLA! REINVIERTE LO VENDIDO EN MÉXICO
702,UCQXlV2X9t-Tf7LyAuKeKIjg,pw57XXpanoU,King Felipe VI of Spain attending the opening of parliament in 2023
703,UC3ba02Spww-stqrKRGauGwQ,kySatELaX1o,PROFESOR HISTORIA DE EEUU _ CONTRA LA INJUSTA LEYENDA NEGRA ESPAÑOLA +INFO EN  LA DESCRIPCIÓN ⬇️⬇️⬇️
704,UCkHR9m-tscD3ojD7_viIfTA,0qoNp6q7UDc,GUERRA entre PALESTINA e ISRAEL con Jose Antonio Zorrilla
705,UCsT4NSardFSUa0bokXXI6Fg,ihiQ2XhL7E0,Milei sabotea a Argentina al renunciar a los BRICS - Entrevista con Ezequiel Bistoletti
706,UCRXzVW7CPvf5A1sDrqZoQSQ,jozhi98VPTI,ISRAEL y EE.UU: el reparto de GAZA. RUSIA avergüenza a EUROPA. MILEI hace los deberes. PIB USA
707,UCHk3AYa-vLhutl5FtYnLi-A,18wQe-ZfQ6g,"La Fed y Jerome Powell, califica de “prematuro” hablar de recortar los tipos y planea más subidas"
708,UCLVbAuT5k2RFAK9t4McnOgw,,Tarot médium Nayade Sol CANAL OFICIAL
709,UCxOahresT9J8qOYMYATh5QA,Z0pU-6FTmoY,💥BRUTAL💥El PSOE con el &quot;alma en un puño&quot;: SÁNCHEZ se descompone por momentos
710,UCSObQEcfLXYmRPgebBEFiXw,-FbDSSzqRII,CENÁRIOS GLOBAIS ECONÔMICOS EM DESTAQUE. #shorts
711,UCG-PWAwwnL8F6S4j_XCBFQQ,TzoroHyC_Ys,EEUU-ISRAEL-ESPAÑA-FRANCIA-CANADA-COLOMBIA-PERÙ-RADIO EN VIVO G24 GLOBAL PRESS
712,UCQmkALEkCFoarsEkeZlzH_w,zT_4S5-ZVfc,El gobierno divide a los españoles y vende propaganda
713,UC-iZcSmvVFSRER9y1UzTBLw,2tvaHaQv4rI,Caporales
714,UCnH7tKC7qurrc0bAvKQEQAg,Omh1u926nwA,01 Dec2023:El programa de acciones de Spain EverydayAI pronosticará lassubidasybajadasde lasacciones
715,UCnH7tKC7qurrc0bAvKQEQAg,gVfzQH99mL8,30Nov.2023:El programa de acciones de Spain EverydayAI pronosticará lassubidasybajadasde lasacciones
716,UCEVw0kuAF01D1-UzOxSkdCg,KBia3O1Lv2Y,FILTRACIONES GTA VI | PEDRO SANCHEZ ¡PIDE CAMBIAR CONSTITUCION! | ALERTA ¡SINDROME de PULMON BLANCO!
717,UCjvvLZC3w4012Po1ZGrubMg,wNKI_aU8zP4,Amor editorial y anarquía social
718,UC3eMLSybqcyQTx5l9o4F3Hg,8bgP5rsBop0,¡Así es la VIDA de ELON MUSK EL HOMBRE MAS RICO DEL MUNDO!
