,canal_ID,video_ID,video_Title
395,UCUBIrDsIVzRpKsClMlSlTpQ,3FFOxhBSYAs,Por qué Ceuta y Melilla pertenecen a España si están en África
396,UCrdGjkqTZVMmAOk4YDjFV-w,OwjN7pxukBQ,"¡Sánchez, tu amnistía es inmoral!"
397,UClLLRs_mFTsNT5U-DqTYAGg,lcuhuZNXqbg,La controvertida empresa Desokupa llega a Barcelona y advierte con actuar
398,UCS6Y-E3Rwm3XXOfSi4RDnBQ,xcHQlfXPcQs,¿DÓNDE DEBERÍAN JUGAR los equipos catalanes en caso de INDEPENDENCIA?
399,UCispGs-Zec1lVsp32rMgqkg,uLKH4cIRsmQ,Iñaki Gabilondo desmonta EN DOS MINUTOS a la derecha española #LasEntrevistasDeAimar
400,UCUBIrDsIVzRpKsClMlSlTpQ,3FFOxhBSYAs,Por qué Ceuta y Melilla pertenecen a España si están en África
401,UCrdGjkqTZVMmAOk4YDjFV-w,OwjN7pxukBQ,"¡Sánchez, tu amnistía es inmoral!"
402,UClLLRs_mFTsNT5U-DqTYAGg,lcuhuZNXqbg,La controvertida empresa Desokupa llega a Barcelona y advierte con actuar
403,UCDdnBGLNmifjQqHjAA_DUrA,js0eCimp_es,&quot;De un gobierno ilegítimo a un gobierno ILEGAL&quot; Santiago Abascal VOX #shorts
404,UCS6Y-E3Rwm3XXOfSi4RDnBQ,xcHQlfXPcQs,¿DÓNDE DEBERÍAN JUGAR los equipos catalanes en caso de INDEPENDENCIA?
405,UCispGs-Zec1lVsp32rMgqkg,uLKH4cIRsmQ,Iñaki Gabilondo desmonta EN DOS MINUTOS a la derecha española #LasEntrevistasDeAimar
406,UCv2BcgqxHSrl2QQfIkjR5Eg,JFl2a3vbe8g,"Ciudadano Cake, en una manifestación contra la dispersión de los presos de ETA"
407,UCrdGjkqTZVMmAOk4YDjFV-w,gSSOU4-3_2w,💥 La guasa de Pablo Motos y Miguel Lago ante la denuncia de Podemos: “Me pido la litera de arriba”
408,UCvJS-YNyaWyOucx8bGrHVvw,DJA1GCJNr6Q,🔴📡 El ministro de Justicia y Presidencia Félix Bolaños comparece en rueda de prensa en Bruselas
409,UCvJS-YNyaWyOucx8bGrHVvw,VaZ67kbYXEs,La frialdad de Txapote indigna a la magistrada
410,UCrdGjkqTZVMmAOk4YDjFV-w,7Z2fFWvsIx0,Colosal paliza de Carlos Alsina a Zapatero por defender la amnistía a los golpistas
411,UCf6W-gNFClPt_XtQ6P44NTg,XPlfOVHD5KU,LA ANTORCHA| Ayuso vuelve: activa al PP contra la amnistía de Sánchez y las amenazas de Yolanda Díaz
412,UCXISYK3xagaK5DHnhQ4X0hw,YsDa8zzKM9c,OLIVER KAHN HABLA DEL REAL MADRID EN CHAMPIONS | Diario AS
413,UCGXbLrVe8vnkiFv7q2vYv3w,cRcak4GP3xc,🔴 DIRECTO BARCELONA | Manifestación de Societat Civil Catalana contra la amnistía
414,UCPH3Oz99Y_jrVBCQMjQZNSg,KZFrXNPNX_Y,✅ RESUMEN: la PRESIDENCIA de SÁNCHEZ en 10 minutos | ¿Qué ha hecho PEDRO SÁNCHEZ en 4 años?
415,UC8FOhz3iXhF1iqqzAFfBjmA,NhpYqHXvKdk,"La hemeroteca vuelve a traicionar a Sánchez: «Líderes independentistas, nunca significa nunca»"
416,UCWpBYQF-ZuL6FQ05OIL9Yzg,cms_rTT8zCM,A FAVOR O EN CONTRA DE LA MANIFESTACIÓN Y LA AMNISTÍA / ENTREVISTAS / DERECHAS VS IZQUIERDAS
417,UCtL_e_TbaHj7TvXI6P_Z3Ow,ISPQA4gke0I,🔴 RESPONDO A IRENE MONTERO y al MINISTERIO DE IGUALDAD | Xokas
418,UC7QZIf0dta-XPXsp9Hv4dTw,zcpMe9kvgTk,La REINA LETIZIA cumple 50 AÑOS: Cómo era la JOVEN PERIODISTA que conocimos en el TELEDIARIO | RTVE
419,UCvmXCP4_uD4Imt8npcFXZ4A,QUzKbklaDVA,"Bolaños, tras reunirse con la Comisión Europea:  &quot;Hay cero preocupación&quot; por la ley de amnistía"
420,UC-9V-k1ugOGSePgIw3UevTQ,o-OPrca8bic,"Cándido Méndez: &quot;La palabra amnistía no es interpretable, significa borrar los delitos&quot;"
421,UCaJQmsB8tpc-T6qHo1hFgOA,-s8x4yHYkN4,LA CONSTITUCIÓN ESPAÑOLA DE 1978: LA RECONCILIACIÓN
422,UCWpBYQF-ZuL6FQ05OIL9Yzg,7P9hWXhqxWA,"AMNISTIA, LA VERDAD DE LA MANIFESTACIÓN, en Directo"
423,UCLNZvDlwQJMaQg477NAxvjQ,R_qjFOCCBT0,¿Por qué perdió la voz Miguel Bosé? - El Hormiguero
424,UC-9V-k1ugOGSePgIw3UevTQ,IChMMW_Ysm0,Aznar habla claro del plan de Pedro Sánchez: &quot;Voy a gobernar contra vosotros&quot;
425,UC8FOhz3iXhF1iqqzAFfBjmA,pgx9O59AI10,Jaime Bayly le hace un traje a Pedro Sánchez: «ha hecho un Gobierno mediocre»
426,UCCJs5mITIqxqJGeFjt9N1Mg,MqZtj2HptyU,Rifirrafe entre Bescansa y Nart a propósito de la &quot;Justicia para ricos y pobres&quot;
427,UCv05qOuJ6Igbe-EyQibJgwQ,yj9N9DTtdas,La Guerra Civil española
428,UCVimQoXNCZuEnZRVAbuYMiw,P6oDtbx0aCE,Ayuso hace gala del anticatalanismo en la Asamblea de Madrid y así le responde la izquierda
429,UCGXbLrVe8vnkiFv7q2vYv3w,5uKZJCLSwYU,Sánchez admite ya el diálogo sobre la amnistía: &quot;Estamos negociando con los grupos&quot;
430,UC7QZIf0dta-XPXsp9Hv4dTw,dyLNpQoB8V4,BONANOVA: BLINDAN la ZONA al COINCIDIR concentraciones a FAVOR y en CONTRA de la OKUPACIÓN | RTVE
431,UCDdnBGLNmifjQqHjAA_DUrA,Nh97MFWC148,FEIJÓO o AMNISTÍA: Aitor Esteban responde a Cuca Gamarra #shorts
432,UC9eCLBSj2fCYUsnMuelRloQ,qB7qTgeIFbA,Así empezó el Alzamiento Nacional en julio de 1936  | España dividida: La Guerra Civil en color
433,UCkHR9m-tscD3ojD7_viIfTA,5GJVJ9X1qP4,¿ÉS LEGAL la AMNISTÍA en ESPAÑA?
434,UCEwy0HNCqAJCYSoyRIZWagw,7gjXQAn-g5s,#TuEspacioINACIPE | &quot;Reflexiones sobre la Ley de Amnistía&quot;.
435,UCPd-Lf5gQkAJD5XdTmT_GGA,7PGwMV8hiQo,Alsina: &quot;Sánchez admite que la amnistía es su investidura y da por seguro que tiene a Puigdemont&quot;
436,UCSQ3311PCxRCxVxjYSKuv1g,HU041Mm3HlA,¿ESPAÑA QUIERE LA AMNISTÍA?
437,UCWZvD9i6M01UY5XIHpCDhrQ,MfaZul6ZeK4,Rechazo la amnistía como solución para los independentistas radicales;
438,UCncWSd2X_nE17RoVfaSdCtg,EYVX6ufEjFc,Eurodiputados SE REBELAN contra la amnistía en Europa: “Va en contra de la ley”
439,UCcMsLx-jktg6OL5IhCEVOOA,s4PfK-_0zk0,Sistemas de financiación internacional de Amnistía Internacional
440,UC1KFgMi-KVzNKnvYIkFxqCg,bxAVRAMN-R8,HOY EN SUIZA PUIGDEMONT DIRIGE ESPAÑA
441,UC7QZIf0dta-XPXsp9Hv4dTw,3rmrfVqqEEM,El 23-F PASO A PASO: cómo transcurrió el intento de golpe de Estado | RTVE Noticias
442,UCjbY0UjwkK71hjZxPd09oqw,nsqlxDAAA88,REQUISITOS para VIAJAR a ESPAÑA actualizados | Mayo 2023
443,UCWpBYQF-ZuL6FQ05OIL9Yzg,_h7urSuex4Y,PREGUNTAS A MUJERES SOBRE LA LEY SOLO SÍ ES SÍ #feminismo
444,UCrdGjkqTZVMmAOk4YDjFV-w,i35lxLgGyVY,💥 APOTEÓSICO repaso de VICENTE VALLÉS a PEDRO SÁNCHEZ por su nueva contradicción electoral 💥
445,UCnsvJeZO4RigQ898WdDNoBw,OdgZVGTIYx8,Mujeres en Afganistán: ¿Cómo ha cambiado su vida bajo el régimen talibán? | EL PAÍS
446,UCWZvD9i6M01UY5XIHpCDhrQ,PmtOQnp1KfM,La amnistía para los que quebrantan la ley en nombre del independentismo es un desprecio al estado
447,UCsRnhjcUCR78Q3Ud6OXCTNg,6VJ8EA6UJ_k,Hombre irrumpe acto feminista con grito machista en España
448,UCvosUrZ7hXpzAyobhfztg4w,EFnyl3n70nU,LA RESISTENCIA - Entrevista a María Pombo | #LaResistencia 15.11.2022
449,UC-yJ1V3fN75A4dlR6dgRgEg,8R4yelPzdmI,💥 RAY DALIO PREDICE una HORRIBLE CRISIS económica donde TODO COLAPSARÁ |👉 CÓMO puedes PROTEGERTE?
450,UC32TdiIsh_5X8tKr_9rKQyA,dU3SNdTar3g,EEUU anuncia nuevo programa de parole humanitario: abogado de inmigración responde dudas al respecto
451,UC7QZIf0dta-XPXsp9Hv4dTw,r7w4IUox0M8,"INVESTIDURA: PP pide &quot;RECAPACITAR&quot; al PSOE, que exige el CESE del llamamiento al TRANSFUGISMO | RTVE"
452,UC7QZIf0dta-XPXsp9Hv4dTw,lo52pHlAc4Q,"EE.UU.: La Reserva Federal MANTIENE los TIPOS de INTERÉS entre el 5,25 y el 5,5% I RTVE"
453,UCXGKSnwhRCUYtqGFGjZKVGw,kxOG8vPy-oo,Antonio Resines - OPINIÓN AMNISTÍA
454,UCnsvJeZO4RigQ898WdDNoBw,V85Iy0nMllY,Javier Cercas: “Fui a la literatura buscando un sucedáneo de la religión” | El País
455,UCrdGjkqTZVMmAOk4YDjFV-w,B6-7jZu-Ebc,💥 PABLO MOTOS y su tropa de &#39;El Hormiguero&#39; despellejan al esbirro de SÁNCHEZ que blanquea a BILDU 💥
456,UC1IYhBFQbBWIxirTRbcfIUw,MtQOL1YT32A,Federico a las 7: Sánchez consuma la traición a España
457,UCAonZDcRR3_MaitiqSNE9iA,y4czVCXi5F4,Manifestación contra la posible amnistía en la Plaza Mayor de Guadalajara
458,UC7QZIf0dta-XPXsp9Hv4dTw,YZ00gD-hsW8,PORTUGAL: POLÉMICA por el ALTAR de CINCO MILLONES para las JMJ que presenciará el PAPA | RTVE
459,UC_lEiu6917IJz03TnntWUaQ,lOiANkwu-rY,"Así se fraguó la negociación entre Bukele y la MS-13, según una acusación de EE.UU."
460,UCRwA1NUcUnwsly35ikGhp0A,3MOIQa6KHiQ,Biden quiere facilitar la inmigración legal en EE.UU. | Noticias Telemundo
461,UCO4JB7fuRiSRnI3Ge1x2zKg,v1NUYt1scNs,La VIRAL ENCUESTA que HUNDE la amnistía y a Sánchez
462,UC4ZA-Y1Uvt_HJY9i3fS5OgQ,A2eCHxMJGcU,"XXI Lección sobre la Constitución Española, por Ascensión Elvira Perales"
463,UCr1J_HnnVoXdDOMqe_QD2xQ,2A6wYhI1Gmk,👑ÚLTIMA HORA👑 El REY FELIPE VI NO FIRMARÁ la LEY de AMNISTÍA y la GUARDIA REAL echó a SÁNCHEZ 👑
464,UCO4JB7fuRiSRnI3Ge1x2zKg,CKxIEH3r0cc,Vicente Vallés DESMONTA las mentiras de Bolaños sobre la amnistía en Europa
465,UCyzBoaIJN13fi2b4yDKes5A,pBEpS236oT4,Cantabria reclama a Europa que &quot;no mire a otro lado&quot; con la ley de amnistía
466,UCPnEhFAMXSRjGqoFdhblx5w,4qcCJ40q298,Observatorio Derechos Humanos
467,UCRA2yxh_BIWtxLFrna639Yw,6Q9G5urOMjM,Y TÚ QUE OPINAS? | #pedrosánchez #españa #presidente #psoe #pp #vox #amnistía  #sanchez #cataluña
468,UCLg_WfqLma_FlHCQ1SwcsjA,WVShKu9SC30,&quot;La Ley de Amnistía no es un obstáculo para acabar con la impunidad del franquismo&quot;
469,UC-9V-k1ugOGSePgIw3UevTQ,wip-QG81g_4,&quot;Referéndum de independencia en Cataluña en 2024&quot;: El plan de Pedro Sánchez
470,UC7QZIf0dta-XPXsp9Hv4dTw,TJuAzkphZFg,FEIJÓO califica el DISCURSO de ARMENGOL como &quot;LAMENTABLE&quot; y ABASCAL lo tilda de &quot;MITIN&quot; | RTVE
471,UCvvWGe6qnO-7LxnH3sPKMIg,vviq1sMILDk,Ortega califica de amnistía encubierta de los golpistas y fraude de ley la reforma de la sedición
472,UC_lEiu6917IJz03TnntWUaQ,mBK-2iETS5k,"Nayib Bukele en la ONU: La libertad es algo por lo que aún luchamos en nuestro país, en El Salvador"
473,UCWZvD9i6M01UY5XIHpCDhrQ,vTi7mk8l1xo,"El independentismo, cuando transgrede la ley, no puede ser recompensado con amnistía"
474,UCrdGjkqTZVMmAOk4YDjFV-w,xRICtpGKs8M,"La profecía de Albert Rivera sobre el &#39;Plan Sánchez&#39;, que se ha cumplido para desgracia de España"
475,UCWZvD9i6M01UY5XIHpCDhrQ,2LQLruIyA7s,No puede haber amnistía sin responsabilidad; el independentismo no debe ser incentivado
476,UCUMetKBAHwI4Wdp2pTA9giw,bFeLhB9w-x0,Explicación de la Ley De Amnistía
477,UCS6Y-E3Rwm3XXOfSi4RDnBQ,gHIBpKE0WTg,😡El cabreo más brutal de Almansa por las acusaciones a España de país racista😡
478,UCrdGjkqTZVMmAOk4YDjFV-w,_iNpCHgUwoA,💥 Frank Cuesta y el revolcón histórico a Pedro Sánchez e Ione Belarra por sus leyes chapuceras 💥
479,UCrDPBYXuWhgJbDlpjpwhVAQ,MGK8ve7XHg4,Como se siente uno al ganar un concurso de escritura  #escribir #ddhh 👇
480,UCrdGjkqTZVMmAOk4YDjFV-w,hsjSm1Dcjps,"🚨PEDRO BAÑOS la democracia ficticia, el sistema electoral y promesas incumplidas de los gobernantes"
481,UCNuh-6hOF5MTCEZTXXhSRQA,1Hgp3tbD0sc,AMNISTÍA y PACTOS de INVESTIDURA. Te dejo mi opinión.
482,UCh7LPHafeQH85zLxOCiFGAQ,wEnxnbk4ppM,😱🇪🇸¿QUÉ OPINAN LOS ESPAÑOLES DE LOS CUBANOS? ¿APOYAN LA DICTADURA?
483,UCO4JB7fuRiSRnI3Ge1x2zKg,YSZC0JoVh3A,GOLPE de Europa a la amnistía de Sánchez: “Es un atentado contra la ley”
484,UCWZvD9i6M01UY5XIHpCDhrQ,BUfGsxfKcew,Una amnistía para la investidura NO VOY A CALLAR
485,UCWZvD9i6M01UY5XIHpCDhrQ,FeyVYhaW_KY,🔍 ¿PUEDE EL REY NEGARSE A FIRMAR LA AMNISTÍA? 👑  ¿Corre algún peligro la corona? 👑  Riesgos y Retos
486,UC-9V-k1ugOGSePgIw3UevTQ,ZK6sIDIB99Y,"García-Margallo, con Herrera, alerta: &quot;Estamos en un momento muy grave para España&quot;"
487,UCWZvD9i6M01UY5XIHpCDhrQ,sv4YnMUf5_g,"La amnistía no es una herramienta para aplacar el independentismo, es un escape que evita enfrentar"
488,UC6cnbJpKcEKW_s8nlamIffw,wdkbD010QOQ,Pablo Motos responde a la campaña de Igualdad que utiliza una frase suya: &quot;El Ministerio miente&quot;
489,UC8EdTmyUaFIfZvVttJ9lgIA,6boOqItpYgg,&quot;BORIC NO SE ATREVE&quot;: El intenso debate por amnistía a presos de la revuelta - Contigo en Directo
490,UCop57Z1sYHrtCyxCpE2z2Bg,6dku39QhfDQ,Piqué explica el conflicto catalán: &quot;Es como el padre y el hijo de 18 años que se quiere ir&quot;
491,UCLNZvDlwQJMaQg477NAxvjQ,s2vIDeMp9j4,Pérez-Reverte:  &quot;No puedes tratar igual al alumno brillante que al que no tiene el talento&quot;
492,UClt94_blMHdteUTDGJ4K6zg,uDgDETt9aI0,ENTREVISTAS A UNIVERSITARIOS SOCIALISTAS ¿POR QUÉ VOTAN AL PSOE?¿AMNISTÍA? ¿PEDRO SÁNCHEZ MENTIROSO?
493,UCnsvJeZO4RigQ898WdDNoBw,xBdtuPhzfeA,"CAYETANA Álvarez de Toledo, las FRASES más POLÉMICAS de la candidata del PP"
494,UCrdGjkqTZVMmAOk4YDjFV-w,JTST7zlxHQY,💥 Las seis mejores ‘estocadas’ de Arturo Pérez-Reverte al Gobierno 💥
495,UCEQm1CKkLu28L9Rf5DkVsEA,0WrDYEN8ZYA,PEDRO SANCHEZ ACEPTA QUE PUIGDEMONT TENDRA AMNISTIA #shorts #pedrosanchez #amnistía #puigdemont
496,UC8v-O8I4hICsgjpUukOS4Tg,XqGSb8NVY28,¿EL REY FELIPE VI PUEDE NEGARSE A FIRMAR LA LEY DE AMNISTÍA?
497,UC_4ZpwvtntzTxt0yTF1Xcyw,vB2dHAhSagI,Bruselas estudia la compatibilidad de la amnistía de Pedro Sánchez con las leyes de la Unión Europea
498,UCWZvD9i6M01UY5XIHpCDhrQ,S0VJNPn1ZFM,🔍 ¿PUEDE EL REY NEGARSE A FIRMAR LA AMNISTÍA? 👑  ¿Corre algún peligro la corona? 👑  Riesgos y Retos
499,UCrdGjkqTZVMmAOk4YDjFV-w,ZzUXCbWOWhU,Abascal zarandea a Silvia Intxaurrondo (TVE) por lanzar una grave acusación contra VOX
500,UCWZvD9i6M01UY5XIHpCDhrQ,S0VJNPn1ZFM,🔍 ¿PUEDE EL REY NEGARSE A FIRMAR LA AMNISTÍA? 👑  ¿Corre algún peligro la corona? 👑  Riesgos y Retos
501,UCrdGjkqTZVMmAOk4YDjFV-w,ZzUXCbWOWhU,Abascal zarandea a Silvia Intxaurrondo (TVE) por lanzar una grave acusación contra VOX
502,UCh_chnQ7OJPQ8mZ7vbXFpIQ,pxlIxr7Pwvw,"Frente Obrero, a Iglesias: &quot;Fuera vende obreros de la universidad&quot;"
503,UC84t25xqhPEPpGY7NBZJ_eA,4zG-pGEcIDc,"La reflexión de Pablo Motos: &quot;La preocupación nunca cura, pero te roba la vida&quot; - El Hormiguero"
504,UCispGs-Zec1lVsp32rMgqkg,ABoT1sB42xY,DIRECTO | Especial de Hora 25 desde Vitoria
505,UCnsvJeZO4RigQ898WdDNoBw,le2vAx3Dd-I,AZNAR a IGLESIAS: &quot;Usted me parece un peligro para las libertades y la democracia en España&quot;
506,UCQ2Fej5pr1ipVeBWTX8Sc_Q,vt-vZMFY-GU,&quot;No son de los tuyos&quot;: el repaso de Rufián a Vox en 4 minutos
507,UCEQm1CKkLu28L9Rf5DkVsEA,XhLcYiifN9M,LA AMNISTIA DE SANCHEZ ES OLVIDAR ESTO DE PUIGDEMONT #shorts #sanchez #amnistía #puigdemont #vox
508,UCI9JodXHKa_FBPW8IxKyBVw,vtHc9GQuLq4,ABASCAL BRUTAL &#39;Amnistía = Golpe de Estado&#39;  Congreso Vox
509,UCWZvD9i6M01UY5XIHpCDhrQ,R2cfUrAkDeA,🔥 Un 41% de votantes del PSOE está en contra de la Amnistía 🤔 ¡Lo que Piensan los Españoles! 🇪🇸
510,UCrdGjkqTZVMmAOk4YDjFV-w,0V6TQyI6Y-8,💥 &quot;¡INDECENTE!&quot; 💥 PABLO MOTOS sopapea a IRENE MONTERO por DIFAMARLE en una campaña publicitaria
511,UC-9V-k1ugOGSePgIw3UevTQ,uiU3g6bRgMs,"Rosa Díez, a Herrera: &quot;El PSOE es ahora una empresa familiar a nombre de Sánchez&quot;"
512,UCi4JOMSiIJxdNyUbYKS1vJQ,VrEh8j0SD94,Adrián Vázquez en COPE
513,UCzuzrcmcv1cPsJCt461yBmw,6UxFqBGKrFw,Mi opinión sobre la situación política actual de España: la &quot;AMNISTÍA&quot; y el proceso de investidura
514,UC8FOhz3iXhF1iqqzAFfBjmA,B7aIaVRJWVs,Sánchez: retrato de una gran mentira
515,UC7QZIf0dta-XPXsp9Hv4dTw,aOhQ0be_1tg,APPLE: FRANCIA RETIRA IPHONE 12 por EXCESO DE RADIOFRECUENCIA. La COMPAÑÍA lo NIEGA |RTVE Noticias
516,UCIvqcSPbzQBynjq230v9_yw,TSqeTzxscI8,"En el surrealista templo franquista de Ávila con el &#39;antirrojos&#39; Eladio: Perros sí, perroflautas no"
517,UCI9JodXHKa_FBPW8IxKyBVw,cr-xBMecV3g,GONZALEZ / &quot;El Futuro de Cataluña: ¿Autodeterminación o Amnistía?#shorts
518,UCncWSd2X_nE17RoVfaSdCtg,0inIpxW03Q4,Eurodiputado francés HUNDE a Sánchez: “Miserable y peligroso”
519,UCrdGjkqTZVMmAOk4YDjFV-w,1jb2kAuwER4,¡Netanyahu debe romper relaciones con Pedro Sánchez! ¡Ortega Smith más valiente que nunca!
520,UCncWSd2X_nE17RoVfaSdCtg,_NqCX-a3xQ4,El Rey Felipe VI PLANTA CARA a Sánchez: “No firmaré la amnistía”
521,UCEQm1CKkLu28L9Rf5DkVsEA,Htp5BScHLzI,SEÑORA MAYOR GRITA A PEDRO SANCHEZ POR LA AMNISTIA #shorts #amnistía #pedrosanchez #sanchez #vox
522,UC-9V-k1ugOGSePgIw3UevTQ,b6UZk2nKsbM,Zapatero defiende la normalización de Bildu: &quot;España va mejor si los que la cuestionan participan&quot;
523,UC_4ZpwvtntzTxt0yTF1Xcyw,OgPgBsxGf28,"SÁNCHEZ dijo que la AMNISTÍA iba contra la CONSTITUCIÓN, ahora cambia de opinión"
524,UCAqHX_gmXMApQUtSTGaX6ng,w87Sc_irgT0,Cristina Almeida y su falsedad sobre la amnistía a Puigdemont.
525,UCrdGjkqTZVMmAOk4YDjFV-w,6XFNd3Ue3qE,Felipe GONZÁLEZ sacude a SÁNCHEZ y los compinches del PSOE: &#39;Crean pobreza y destruyen ESPAÑA&#39;
526,UCUS73_bjTYwBFAfXbvIjM8Q,cht74hGvZMY,El Programa de Cuesta: El plan de Sánchez contra los jueces antiamnistía y la frutera Yolanda Día
527,UCVimQoXNCZuEnZRVAbuYMiw,0yOeG7G59uM,Reacciones al nuevo &quot;escándalo&quot; de Juan Carlos I: &quot;Ya no nos puede sorprender&quot;
528,UCMVNoR-l6986wNIHsajvHqw,Id0wgLGzTgA,UNIVERSITARIOS OPINAN SOBRE LA AMNISTIA del PSOE 🌹
529,UCWZvD9i6M01UY5XIHpCDhrQ,NVtLYEdEWXc,🔍 ¿PUEDE EL REY NEGARSE A FIRMAR LA AMNISTÍA? 👑  ¿Corre algún peligro la corona? 👑  Riesgos y Retos
530,UC84t25xqhPEPpGY7NBZJ_eA,AW-pfW5kuw4,Arturo Pérez-Reverte habla del lenguaje inclusivo y la evolución de la lengua - El Hormiguero
531,UCOxQk41rWFLWLPAPP_as6uA,9sYUClaq6s0,"Javier Aroca, sobre la &#39;ley del solo sí es sí&#39;: &quot;Estos jueces no tienen ni puñetera idea&quot;"
532,UCVimQoXNCZuEnZRVAbuYMiw,DWphWVZAUS0,Albanta San Román: &quot;Se enfocan en la minoría de las denuncias falsas y no ven todo lo demás&quot;
533,UCCs7wXL-OLYxzBL9lQWFEbw,ZJT9C4VvX8A,Retransmitiendo en directo ahora desde Salón de Plenos
534,UC84t25xqhPEPpGY7NBZJ_eA,JlwR85A6Bx4,Una anécdota de Millán Salcedo provoca un ataque de risa a Pablo Motos - El Hormiguero 3.0
535,UCEQm1CKkLu28L9Rf5DkVsEA,wySgfW7hPRI,GUARDAR ESTE VIDEO DE LA AMNISTIA DE SANCHEZ 2 SEMANAS #shorts #amnistía #puigdemont #sanchez #vox
536,UC2T6NU6-JLWzAzaGdqvNyzA,Ntm_Il9IanM,España dice ¡BASTA YA! a Sánchez y la amnistía en la manifestación de Colón
537,UCkrULMpJd04PEtr0fvhjDKw,oX_W1aH5ANo,Fernando Valls: &#39;Alguien cercano al PSOE figura en la lista de amnistía fiscal ´
538,UCvosUrZ7hXpzAyobhfztg4w,msKDozyQ7yw,LA RESISTENCIA - Entrevista a José María García | #LaResistencia 30.05.2023
539,UCasTaTH-8IPGSgzaDZ2oRUQ,s7XR8GS44og,La VIRAL ENCUESTA que DESTROZA la amnistía y a Sánchez
540,UCnANUkcRLl_LcXas3IPbUXw,rUmUG0_wPQY,1ª Jornadas por la Amnistía de los Presos Políticos (Adelanto)
541,UCh1OgMIWOlDBhFEYL3DHWjQ,q2V6R1Q1j5I,El mensaje de Arguiñano a los que dicen &#39;no&#39; a los migrantes
542,UCUS73_bjTYwBFAfXbvIjM8Q,i7LNabYjM-0,Pedro Sánchez promete &quot;la lealtad del Gobierno&quot; a Leonor
543,UCvmXCP4_uD4Imt8npcFXZ4A,ZQPhLzJ5DK0,¿Quién fue Lluís Companys? | Vozpópuli
544,UCUS73_bjTYwBFAfXbvIjM8Q,mGRMZOL2QOc,Esta es la venganza que prepara Puigdemont contra el Rey
545,UCO0m07NR5mlee9KZMJOUrpQ,2eyDTyLLKuo,¡LECCIÓN MAGISTRAL ! -  Javier Pérez Royo &quot;DEFIENDE&quot; la Ley de Amnistía
546,UCZqQbiylnY4E0KqZFhWpung,aJPthTgdg8Y,ENTRÉ CON VISA DE TURISTA Y ME VOLVÍ RESIDENTE 2022/USA 🇺🇸
547,UC_4ZpwvtntzTxt0yTF1Xcyw,Wy9yOUoXkRU,La única esperanza contra la amnistía de Sánchez puede ser la Unión Europea
548,UCBYyJBCtCvgqA4NwtoPMwpQ,BVKz6b8w1bI,¿PUEDE DONALD TRUMP SER REELEGIDO COMO PRESIDENTE? - David Jiménez no es optimista al respecto
549,UCEQm1CKkLu28L9Rf5DkVsEA,w4TQEtFqzI0,YOLANDA DIAZ TIENE UN COMITE DE EXPERTOS PARA LA AMNISTIA #shorts #yolandadíaz #amnistía #puigdemont
550,UCrdGjkqTZVMmAOk4YDjFV-w,QoaALDKkblc,💥 Alfonso Guerra hace un traje a Sánchez: &quot;¡Es el peor PSOE desde la República!&quot; 💥
551,UCEQm1CKkLu28L9Rf5DkVsEA,OTh74z3h--A,YOLANDA DIAZ PIDE QUE NADIE SE MANIFIESTE #shorts #yolandadíaz #aznar #puigdemont #amnistía #vox
552,UC5HdVtarytnZi4eLogHAfoQ,_CG227BMa2o,¿Pueden las PENSIONES ARRUINAR a ESPAÑA?  - VisualEconomik
553,UC-YYOKIpuJj6z-cK6OT0KEA,aFzKFQPFCmM,&quot;Comisión Europea Solicita Información Sobre Ley de Amnistía en España 🇪🇺 - Lo que Debes Saber
554,UCO4JB7fuRiSRnI3Ge1x2zKg,I4GntPw-dRw,Felipe González ESTALLA contra la amnistía de Sánchez: “Es intolerable”
555,UCS6Y-E3Rwm3XXOfSi4RDnBQ,TMwDvgLwU4A,Pedrerol: &quot;Los que dicen que van a salvar Catalunya la van a hundir&quot;
556,UCrdGjkqTZVMmAOk4YDjFV-w,VzdeZQXnyws,Javier Nart no se corta y le mete un repaso a Rodríguez Pam: &quot;Incompetente y analfabeta mental&quot;
557,UCknyABjdbf5eQdzp0FKVt5g,9Ht3shPYulM,PEDRO SANCHEZ:Más Allá de la Política.DESCUBRE LA VIDA Y TRAYECTORIA del Presidente de ESPAÑA
558,UCeLpjDDpBoW7lsicIah597g,2SyHn-jJWzI,Pedro Sánchez Defiende la Ley amnistía en su discurso de investidura
559,UCR5b2KxoYSBGIc7Tg7I1DkA,TfuQ-oKr2z0,Cinco situaciones que ocurren en una consulta de salud mental en la sanidad pública.
560,UCVimQoXNCZuEnZRVAbuYMiw,bUD_VrPc2WI,"Pablo Iglesias y Virginia P. Alonso entrevistan a Inna Afinogenova, nuevo fichaje de &#39;La Base&#39;"
561,UC9XEHiukfzJceSdzkYBjgtg,zpEFklcx7wE,Informe Europeo PARALIZA LA AMNISTÍA de Pedro Sánchez: “Vulnera el tratado”
562,UCl0Vgep9e-ymRAX4CYZsozA,TpL0YI2ptNk,ESPAÑA | Pedro Sánchez defiende la Amnistía en CATALUÑA por la Convivencia entre Españoles
563,UCPH3Oz99Y_jrVBCQMjQZNSg,5Zwv43MUA7s,✅  La GUERRA CIVIL ESPAÑOLA en 13 minutos | Resumen fácil y divertido
564,UC8v-O8I4hICsgjpUukOS4Tg,ZWJUfrMjj1U,ANTONIO RESINES CARGA DURAMENTE CONTRA LA LEY DE AMNISTÍA DEL GOBIERNO DE PEDRO SÁNCHEZ
565,UCWZvD9i6M01UY5XIHpCDhrQ,Q41aQXXLh7U,🔥 ¿Creen que terminaremos aceptando la amnistía? 🤔 ¿Es la Amnistía de Puigdemont la Solución? 🌍
566,UCwd8Byi93KbnsYmCcKLExvQ,pK7C-vBlLpc,"MUNDO EN GUERRA | Europa contra sus miembros, Blinken corre a Israel y la opinión de China"
567,UCVimQoXNCZuEnZRVAbuYMiw,wC8BJpL8KWA,Ni superhéroes ni pobrecitos: personas con discapacidad claman contra el estigma social y mediático
568,UC7QZIf0dta-XPXsp9Hv4dTw,LDXk6csAH5Y,Las noticias del JUEVES 30 de NOVIEMBRE en 10 minutos | RTVE Noticias
569,UCGkwr0nuhvMrf7b2mzmlODQ,OFgEKnHJnS8,HEMEROTECA 4: AMNISTIA #shorts #hemeroteca #humor #comedia #memes
570,UCWpBYQF-ZuL6FQ05OIL9Yzg,Xr6dIhdHk2E,8M ENTREVISTAS A FEMINISTAS EN EL 8M 2023
571,UCI3EXOyQ5_imsQJs5pq28XQ,AX36ow4PQSU,García Page: O Puigemont se apea del referéndum o será una legislatura complicada
572,UCEQm1CKkLu28L9Rf5DkVsEA,6-SaAjw_UpY,YOLANDA DIAZ Y SANCHEZ YA TIENEN PACTO DE AMNISTIA #shorts #yolandadíaz #pedrosanchez #amnistía #vox
573,UCEQm1CKkLu28L9Rf5DkVsEA,i82J4gcrGm4,PIDEN AMNISTIA Y DICEN A CAKE MUNIESA ESTO #shorts #CAKEMUNIESA #amnistía #puigdemont #vox #abascal
574,UCzFESlED8MTJOTHpQhxlqGg,BvGlZrjeiTE,LEY DE MALESTAR ANIMAL
575,UCEQm1CKkLu28L9Rf5DkVsEA,C2AL6z3LV9o,VOX DESTAPA LAS MENTIRAS DE LOS CATALANES #shorts #vox #cataluña #puigdemont #abascal #amnistía
576,UCEQm1CKkLu28L9Rf5DkVsEA,Y287OeXAlZc,PEDRO SANCHEZ SE BURLA DE LA JUSTICIA POR LA AMNISTIA #shorts #amnistía #pedrosanchez #vox #abascal
577,UCQMxaO-iJ3Jcf0cMWh3VLaQ,dbVIWY8Rf_I,Foro Técnico ALNYLAM | Litiasis de origen genético sospechando la hiperoxaluria primaria
578,UCEQm1CKkLu28L9Rf5DkVsEA,cGyk-gG52To,A PATXI LOPEZ NO LE CONSTA LA AMNISTIA DE SANCHEZ #shorts #pedrosanchez #amnistía #PATXILOPEZ #vox
579,UCQ2Fej5pr1ipVeBWTX8Sc_Q,,Cadena SER
580,UC9XEHiukfzJceSdzkYBjgtg,ot9M-vqOe_8,Europa DESMIENTE a Félix Bolaños por la ley de amnistía
581,UCUS73_bjTYwBFAfXbvIjM8Q,uA2K5b1WcBc,El chasco de Sánchez al descubrir que el trono no es para él
582,UCEjzcSszV-WnMXMFdpylOHg,Qa87gQK6jjQ,Declaración de Serrat y respuesta a quienes le llamaron fascista
583,UCPd-Lf5gQkAJD5XdTmT_GGA,WsNwoZOlUGU,Alsina entrevista a Pedro Sánchez: &quot;No es cierto que haya gobernando con Bildu&quot;
584,UCPrSrtwcgim_KpNlwhUB64A,hf22wZUXbFM,Hora Veintipico #179 | Entrevista a Nieves Concostrina
585,UCEXDCxwktpMMFhTSGdEP3EA,Q1vxOdAb3Uc,¿Debe intervenir el Estado en la economía?
586,UCEQm1CKkLu28L9Rf5DkVsEA,GzlhXEtmT7g,SANCHEZ TIENE PACTADA YA LA AMNISTIA CON PUIGDEMONT #shorts #sanchez #puigdemont #amnistía #vox
587,UCwhHvmXZd490g5qvyqHez7w,gAwWUUC4E-w,OPINION El circo de la amnistía
588,UCP-ltOcWgSFHbW9DfiTvjoA,7pl6crJrhhc,ALFONSO GUERRA &quot;SE REBELA&quot; contra PEDRO SÁNCHEZ ¡POR PACTAR LA AMNISTÍA CON PUIGDEMONT!
589,UCEQm1CKkLu28L9Rf5DkVsEA,9etNVGAzMvA,FEIJOO AVISA EL REFERENDUM ES EL CEBO DE LA AMNISTIA #shorts #feijoo #sanchez #referendum #amnistía
590,UC4qcZtVYgcOarmCSd4SVO2g,1D-7js5sucA,opiniones 👇🏽 Fuente: Kloshletter y 20 minutos #noticiastiktok #8deoctubre #amnistia #barcelona
591,UC9c4rND1mNP-XrWQjbFxp8g,AnhW2fm2jvs,¡VERGÜENZA! PROPUESTA CUOTA AUTÓNOMOS E IMPUESTOS | CRÍTICA 🇪🇸
592,UC98RU12SxTTJnj2nYiwGcSg,U5-qa6SE99w,AMPLIACION DE LA AMNISTÍA (15-10-1977)
593,UCxOahresT9J8qOYMYATh5QA,5sGW2rwzKhA,💥El Parlamento europeo acuerda debatir la amnistía y sitúa a España al nivel de Hungría y Polonia💥
594,UC8FOhz3iXhF1iqqzAFfBjmA,AC1qeUV6GwE,Tibia respuesta del PSOE a la exigencia de referéndum de ERC y Junts
595,UCZ4hdOTEvodnLGN8Fb9YKeg,IbQv5iEoHKE,Jordi Wild da su opinión sobre la amnistía
596,UCEQm1CKkLu28L9Rf5DkVsEA,J4K-ZJUaUl8,EMILIANO GARCIA PAGE CRITICA A PEDRO SANCHEZ #shorts #pedrosanchez #emilianogarciapage #amnistía
597,UCBYyJBCtCvgqA4NwtoPMwpQ,CGIGxUR695A,"The Wild Project #21 feat Roma Gallardo | Feminismo, VOX, Okupas y Menas, Risto Mejide"
598,UCWZvD9i6M01UY5XIHpCDhrQ,-g67ghQj9tY,Otorgar amnistía a aquellos que buscan la independencia por medios ilegales es traicionar
599,UChBENysA2XJX60IoEQmbt8g,p6ghs3XLnGg,77/ Model per armar: la llei d&#39;amnistia i la justícia transicional
600,UCasTaTH-8IPGSgzaDZ2oRUQ,a9XEzDenGSM,RIDÍCULO APOTEÓSICO de Cristina Almeida por DEFENDER la Ley de Amnistía
601,UC7QZIf0dta-XPXsp9Hv4dTw,AUVbPfYxACc,ÁLVARO PRIETO: La POLICÍA BARAJA la ELECTROCUCIÓN como PRINCIPAL HIPÓTESIS sobre SU MUERTE | RTVE
602,UC7QZIf0dta-XPXsp9Hv4dTw,UClWRdkwzLU,"BORRASCA CIARÁN: Casi TODA ESPAÑA en ALERTA por rachas de VIENTO, fuertes LLUVIAS y mala MAR | RTVE"
603,UC1KFgMi-KVzNKnvYIkFxqCg,11d9oekmQ-w,SE DESATA LA POLÉMICA EN LA INAUGURACIÓN DE LA XV LEGISLATURA.
